title,author,genre_id,genre,ISBN,description_aladin,description_naver,salesPoint,mallType
에세이스트의 책상,배수아 (지은이),50993,국내도서>소설/시/희곡>한국소설>2000년대 이후 한국소설,9788954680400,"배수아 컬렉션 시리즈. ‘배반의 글쓰기’라 불릴 만큼 이질적인 작품으로 독자를 당혹스럽게도, 또 즐겁게도 해온 배수아 작가, 그가 또 어떻게 우리를 놀라게 할까 하던 독자들의 기대를 완벽히 충족시켰던 작품이다.","“나는 소설을 쓰기를 원했으나, 그것이 단지 소설의 형태로만 나타나기를 원하지는 않았다. 무엇이라고 불리는가 하는 것은 그 이후의 문제가 될 것이다.”
정신에 대해, 사랑에 대해, 언어에 대해, 
그리고 음악에 대해

‘배반의 글쓰기’라 불릴 만큼 이질적인 작품으로 독자를 당혹스럽게도, 또 즐겁게도 해온 배수아 작가, 그가 또 어떻게 우리를 놀라게 할까 하던 독자들의 기대를 완벽히 충족시켰던 작품. 2003년 출간되어 마니아 독자를 확보하는 데 큰 역할을 한 장편이다. 초판의 ‘작가의 말’에서 밝혔듯 그는 이 작품이 “단지 소설의 형태로만 나타나기를 원하지는 않았다”. “어느 순간에는 글 속에 담긴 스토리 자체를, 혹은 그런 선명한 스토리에 의존해서 진행되는 글을 내게서 가능한 한 멀리 두고 그 사이를 뱀과 화염의 강물로 차단하고자 했다”고. 그간의 작품에서도 이 특징이 드러나지 않은 것은 아니나, 2000년대 들어 발표하기 시작한 작품들에서 본격화한 것은 분명하다. 관습과 통념을 낯선 방식으로 거스르는 그의 작품은 한층 더 이방인의 것, 이국의 것으로 다가오기 시작했고, 그렇게 느껴지는 것 자체가 우리가 익숙하게 생각해온 경계와 틀을 자각하게 하였다. 그 이후에 오는 것이 지금껏 몰랐던 자유로움은 아닐지. 
소설은 ‘나’의 특별할 것 없는 일상과 그 사이사이 끼어드는 M과의 기억으로 채워진다. 핵심은 또렷한 스토리나 사건이 아닌 ‘나’와 M이 함께한 시간들, 그 시간을 ‘나’가 기억하는 방식이다. 그러므로 흔히 소설적인 것이라고 생각되는 것으로 구성되기 어려운 작품일 수밖에. 마치 M을 정신적 질료로 하여 그에 대한 회상에서부터 풀려나오는 언어나 음악에 대한 생각과 예술 텍스트에 대한 개인적 논평을 펼쳐놓는 에세이처럼 읽히고, 또 실제로 소설 전체가 인물이나 사건이 별로 중요하지 않은 에세이적인 형식을 띠고 있기도 하다. 이 소설의 제목이 ‘에세이스트의 책상’이라는 것은, 그래서 더 의미심장하다.

일반적인 생각대로라면 음악을 내게 더 많이, 라고 말하는 편이 적절할지도 몰랐다. 더 많은 죽음이거나 더 많은 알몸(나체의 개체수를 나타내는 것이 아닌), 더 많은 (단 한 명인) 최초의 인간, 더 많은 우주, 더 많은 음악의 영혼, 더 많은 유일한 것, 더 많은 더 멀리 그쪽으로, 더 많은 멘델스존, 더 많은 M, 그리고 더 많은 그 겨울.
_10쪽",2093,BOOK
마음챙김의 시,류시화 (엮은이),51168,국내도서>소설/시/희곡>시>외국시,9791190382267,백만 독자의 찬사와 인기를 얻은 잠언 시집 &lt;지금 알고 있는 걸 그때도 알았더라면&gt;과 치유 시집 &lt;사랑하라 한번도 상처받지 않은 것처럼&gt;에 이어 15년 만에 류시화 시인이 소개하는 마음챙김의 시들. 삶의 무늬를 담은 한 편 한 편의 시가 가슴에 파문을 일으킨다.,"“날개를 주웠다, 내 날개였다.”

시를 읽는 것은 자기 자신으로 돌아오는 것이고, 세상을 경이롭게 여기는 것이며, 여러 색의 감정을 경험하는 것이다. 살아온 날들이 살아갈 날들에게 묻는다. ‘마음챙김의 삶을 살고 있는가, 마음놓침의 시간을 보내고 있는가?’ 

사회적 거리두기와 삶에 대한 성찰이 어느 때보다 필요한 지금, 손 대신 시를 건네는 것은 어떤가. 멕시코의 복화술사, 영국 선원의 선원장, 기원전 1세기의 랍비와 수피의 시인뿐 아니라 파블로 네루다와 비스와바 쉼보르스카 같은 노벨 문학상 수상 시인, 페이스북과 인스타그램의 신세대 시인들, 그리고 라다크 사원 벽에 시를 적은 무명씨. 고대와 중세와 현대의 시인들이 나와 타인에 대한 운율 깃든 성찰로 독자를 초대한다. 

아름다운 시들을 모았다고 해서 좋은 시집이 되지는 않는다. 진실한 깨달음이 시의 문을 여는 순간이 있다. 백만 독자의 찬사와 인기를 얻은 잠언 시집 『지금 알고 있는 걸 그때도 알았더라면』과 치유 시집 『사랑하라 한번도 상처받지 않은 것처럼』에 이어 15년 만에 류시화 시인이 소개하는 마음챙김의 시들. 삶의 무늬를 담은 한 편 한 편의 시가 가슴에 파문을 일으킨다.",35942,BOOK
꽃을 보듯 너를 본다,나태주 (지은이),51167,국내도서>소설/시/희곡>시>한국시,9791157280292,J.H Classic 2권. 나태주 시집. 나태주 시인의 작품 가운데에서 인터넷의 블로그나 트위터에 자주 오르내리는 시들만 모았다.,"만인의 심금을 울릴 수 있는 서정시의 진수

블랙핑크(BLACKPINK)의 지수와 세계적인 보컬 그룹인 방탄소년단(BTS)의 RM, 송혜교와 박보검 등은 물론 전국민의 애송시인 [풀꽃]이 수록되어있는 나태주 시집 [꽃을 보듯 너를 본다]. “자세히 보아야/ 예쁘다//오래 보아야/사랑스럽다//너도 그렇다.” 나태주 시인의 [풀꽃]은 전국민의 애송시라고 해도 과언이 아니다. 순수하고 꾸밈없는 시어들은 풀꽃의 시처럼 독자들에게 꾸준히 읽히면 더 큰 사랑을 받게 됐다. 평범한 것에 아름다움을 보는 눈, 별 볼일 없다고 생각했던 무언가를 다시보게 하는 힘이 이 시집에 있다.",64531,BOOK
주술회전 5,"아쿠타미 게게 (지은이), 이정운 (옮긴이)",4133,국내도서>만화>본격장르만화>판타지>액션 판타지,9791164595297,"첫날 시작된 단체전은 구획 안에 풀려 있는 2급 주령을 먼저 퇴치하는 쪽이 승리하는 것이었다. 호전적인 토도는 즉각 도쿄 팀을 습격, 이타도리가 그를 상대하게 된다. 그러나 이타도리를 암살하기 위해 다른 교토교의 팀원도 참전하며, 이타도리는 궁지에 처하게 되는데!","교토 자매 학교 교류전, 개막!
더욱 치열한 주술 배틀이 펼쳐지는 제5권 발행

드디어 교토 자매 학교 교류회가 시작됐다. 
첫날 시작된 단체전은 구획 안에 풀려 있는
2급 주령을 먼저 퇴치하는 쪽이 승리하는 것이었다.
호전적인 토도는 즉각 도쿄 팀을 습격, 
이타도리가 그를 상대하게 된다. 
그러나 이타도리를 암살하기 위해
다른 교토교의 팀원도 참전하며, 
이타도리는 궁지에 처하게 되는데!",4521,BOOK
제로 투 원 - 스탠퍼드 대학교 스타트업 최고 명강의,"피터 틸, 블레이크 매스터스 (지은이), 이지연 (옮긴이)",3048,국내도서>경제경영>창업/취업/은퇴>벤처/스타트업/인터넷창업,9788947529877,"페이팔 공동 창업자이자 벤처캐피탈 투자자인 피터 틸이 새로운 것을 창조하는 회사를 만들고, 미래의 흐름을 읽어 성공하는 법에 대해 말하는 책. 저자는 경쟁자를 따돌리고 새로운 시장을 개척하는 ‘독점’이야 말로 진정한 성공과 진보의 필요조건이라 말한다.",,7969,BOOK
웹소설 써서 먹고삽니다 - 웃기는 작가 빵무늬의 돈 되는 작법 수업,정무늬 (지은이),2350,국내도서>컴퓨터/모바일>e비즈니스/창업>e-비즈니스/온라인 창업,9791165215286,"유튜브 채널 &lt;웃기는 작가 빵무늬&gt;를 통해 현직 작가의 실전 노하우를 소개했던 ‘빵무늬’, 이제는 책을 통해 아무도 알려주지 않았던 웹소설 작가 생존 전략 A to Z를 공개한다.","글 써서 먹고사는 가장 확실한 방법!
정답은 ‘웹소설’이다!

‘팔리는 글’ 쓰는 실전 스킬부터
실패하지 않는 계약 · 정산 꿀팁,
아무도 알려주지 않는 전업 작가 생활기까지!

1화만 썼다 지웠다 반복하는 당신을 위해 현직 작가의 실전 노하우를 공개한다. 
글 써서 먹고사는 유튜버 ‘빵무늬’의 웹소설 작가 생존 전략을 따라해보자. 
매달 통장에 인세가 꽂히는 즐거움을 누릴 수 있다.",5115,BOOK
이만하면 괜찮은 남자는 없다 - 왜 평범해 보이는 남성도 여성 혐오에 빠지는가,박정훈 (지은이),51326,국내도서>사회과학>여성학/젠더>여성문제,9791160404777,첫 책 《친절하게 웃어주면 결혼까지 생각하는 남자들》에서 남성 문화를 비판하고 반성의 목소리를 냈던 〈오마이뉴스〉 박정훈 기자가 이번 책에서는 한 발 더 나아가 여성혐오·성폭력·착취의 근원이 남성들의 ‘기만’에 있다는 것을 논지한다.,"“만족하지 않기를, 주저하지 않기를”

더 많은 여성과 남성의 우정을 향한
남성 페미니스트 박정훈의 연대의 목소리

첫 책 《친절하게 웃어주면 결혼까지 생각하는 남자들》에서 남성 문화를 비판하고 반성의 목소리를 냈던 〈오마이뉴스〉 박정훈 기자가 이번 책에서는 한 발 더 나아가 여성혐오·성폭력·착취의 근원이 남성들의 ‘기만’에 있다는 것을 논지한다. 이 책이 여타의 페미니즘 도서와 다른 점은 페미니즘 진영 내부에서 존재하던 다양한 스펙트럼이 외부로 표출된 현상을 분석했다는 것이다. 저자는 그럴 듯해 보이는 남성조차 가해자가 되는 것은 자신들이 ‘세상을 바꿨다’는 충만한 자부심으로 ‘그들만의 세계’에 존재해왔기 때문이라고 이야기한다. 사회 전반에 깔려 있는 여성혐오, 끝없는 여성 성착취 등의 구조가 반복되지 않으려면 이 거창하고 거만한 가부장적 세계를 무너뜨려야 한다고 말하며 새로운 남성성의 대안을 제시한다.
저자는 남성, 비장애인, 이성애자이자 수도권에 살며 기자로 활동하는 자신의 위치를 인지하면서도 여성과 소수자에게 공감하되 동일시하거나 시혜의 관점으로 다가가지 않는다. 남성 페미니스트로서 살아보지 못한 삶을 존중하는 방식으로 논지를 전개해나간다. n번방사건 이후 드러난 또다른 수많은 n번방과 피해자들, 진보인사들의 성폭력 사건, ‘이대남(20대 남자)’의 정서, 백래시의 근거로 쓰이는 메갈리아 이슈, 여성들의 죽음 등 페미니즘에 관한 근간의 사건들을 톺아보며 착취와 억압의 고리에 있는 여성인권의 현실을 좀 더 생생하고 적나라하게 보여준다. 또한 저자가 현장을 직접 취재하며 모았던 자료들과 당사자들과의 인터뷰, 다양한 기사·연구 논문 및 통계 자료 등에 간결하면서도 명료한 저자의 관점을 더해 섬세하고 치밀한 페미니즘 교양서를 선사한다.

“가부장제는 여성과 남성의 ‘성차’를 강조하고, ‘여성다움’과 ‘남성다움’을 규정하면서 남성의 우월적 지위를 유지하는 방식을 취한다. 그런데 남성들의 페미니즘 실천이 ‘시스젠더 이성애자’의 올바른 행동 양식처럼 여겨지기만 한다면, 역설적으로 성별 이분법을 강화시키고 가부장제가 온존하도록 기여하는 셈이 된다. 남성들이 궁극적으로 ‘정상 남성’을 규정하고 있는 공고한 틀을 깨는 데까지 나아가야 하므로 결코 ‘이만하면 괜찮을 수’ 없다는 것이다. 만족하지 않기를, 그리고 주저하지 말기를 남성들에게 당부하고 싶다.”_8쪽",1759,BOOK
해커스 토플 리딩 베이직 (Hackers TOEFL Reading Basic) - 2019년 8월 NEW TOEFL iBT 완벽 반영ㅣ토플 리딩의 기본서,David Cho (지은이),49866,국내도서>외국어>토플>Reading,9788965423041,"2019년 8월 1일 새롭게 시행된, NEW TOEFL iBT  완벽 반영한 토플 기본서. 토플 초보를 위한?기초 독해 4주 완성으로 구성했고 정답단서 + 정확한 해석 + 어휘를 포함한 상세한 해설을 수록했다. 빠른 목표?달성을 위한 전략적인 학습 장치와 토플 점수가 오르는 추가 학습자료를 수록했다.","토플 리딩의 기본서
토플 리딩 베스트셀러 1위

[이런 분에게 추천합니다]
1. 뉴토플이 반영된 최신 교재로 시험을 준비하고자 하는 분들
2. 토플 리딩뿐만 아니라 일반 영어 독해 실력까지 향상시키고 싶은 분들
3. 토플 리딩 시험과 동일한 형식의 실전모의고사로 실전에 효과적으로 대비하고 싶은 분들

[해커스 교재만의 특장점]
1. 2019년 8월 1일 새롭게 시행된, NEW TOEFL iBT 완벽 반영한 토플 기본서

2. 토플 초보를 위한 기초 독해 4주 완성
1) 문제 살펴보기 & 문제 공략하기
문제 유형과 출제 방식 확인, Daily Check-up과 Daily-Test로 문제풀이 훈련

2) Progressive Test 5회분 제공
여러 유형이 혼합된 문제를 풀어보며 앞서 학습한 내용을 총 정리

3) Actual Test 1회분
실제 시험과 동일한 구성 및 난이도의 모의고사로 시험 완벽 대비

3. 정답단서+정확한 해석+어휘를 포함한 상세한 해설 수록
1) 정답/오답 근거를 쉽게 파악할 수 있는 정답단서 제공
2) 정확한 해석 및 어휘 제공
3) 해설집을 별책으로 제공하여 편리하게 학습

4. 빠른 목표 달성을 위한 전략적인 학습 장치 수록
1) 2주/3주/4주/6주 학습플랜
자가 진단 테스트로 자신의 실력을 파악하고, 결과에 따라 자신에게 맞는 학습플랜 선택
2) 교재 활용법 제공
효과적인 교재 학습 팁으로 고득점 공략

[해커스만의 추가 혜택] 
1. 해커스인강 HackersIngang.com
1) 단어암기 MP3
2) 지문녹음 MP3

2. 고우해커스 goHackers.com
1) 토플공부전략 강의
2) 토플 라이팅/스피킹 첨삭 게시판
3) 토플 비법노트게시판 

[베스트셀러 1위] 알라딘 외국어 베스트셀러 토플 Reading 분야 1위(2019년 6월 1주 주간 베스트, 개정 3판 기준)",5375,BOOK
더 보스 - 돈을 통제하라 그리고 원하는 삶을 살아라,안규호 (지은이),70216,국내도서>자기계발>성공>성공학,9791197080821,"경제적 자유를 얻기 이전에 확실한 노력을 통해 자신의 결과물을 증명하고, 부자가 되고자 마음 먹기 이전에 부와 가난의 본질을 이해해야한다. 요행을 바라기 전에 자신의 실력에 대해 냉철하게 바라보며 어떻게 부의 그릇을 키워가야할지 그 누구보다 현실적인 조언을 건네준다.","17만 유튜버 영앤리치 안규호가 말하는 부의 결정판!
이 책에는 노숙자에서 대한민국 0.01%가 거주하는 시그니엘에 들어가기까지
그의 부에 관한 모든 가치관이 들어있다. 

영업은 시스템이라 말하는 안규호 작가는
〈더 보스〉에서 부자의 본질에 대한 BOSS의 BOTH 사고방식에 대해 말한다.

가난한 사람은 자신이 왜(WHY)가난한지 이해 못하고
부자가 어떻게(HOW) 부자가 됐는지에 대해서도 알지 못한다.
반면에 부자들은 가난의 원인이 어디에 있는지 파악하고,
어떻게 하면 더 부자가 될 수 있는지 끊임 없이 연구하고 노력하는 사람이라 정의한다.

알코올 중독자, 신용불량자, 빚쟁이를 피해 공원에서 노숙 생활 했던 그가 시그니엘에 들어가고
수많은 사람에게 선한 영향을 주기까지의 과정은 우리가 원하는 미래를 얻기 위한
자신감과 용기를 심어준다. 자, 이제 당신이 선택할 차례다. 치열한 자본주의 사회에서
주인이 되어서 살 것인가, 아니면 이대로 살아갈 것인가. 모든 선택은 오로지 본인에게 있음을
저자 안규호는 말한다.",3768,BOOK
2022 심우철 합격영어 1 : 구문 - 공무원 시험 단기 합격을 위한 영어 기본서,심우철 (지은이),34626,국내도서>수험서/자격증>공무원 수험서>7/9급 공무원>영어>단어/문법/독해 외,9791162051047,"영어 문장을 정확하게 한국말로 이해할 수 있도록 특별히 개발된 수험서로, 공무원/경찰직/소방직 시험에 등장하는 영어 문장을 법칙화하여 정확하게 해석하는 방법을 제시한다. 구문 학습을 통해 자주 출제 되는 문법 요소들 또한 쉽게 해결할 수 있다.","1.  정확하고 빠른 독해를 위한 가장 현명한 선택
많은 수험생들이 영어의 복잡하고 다양한 문장을 만날 때 해석상의 어려움을 자주 토로합니다. 그런데도 공무원 영어 수업은 영어 해석을 위한 수업보다는 문법 수업에 치중되어 있습니다. 〈심우철 합격영어 구문〉은 영어 문장을 정확하게 한국말로 이해할 수 있도록 특별히 개발된 심우철 선생님의 베스트셀러 구문 수업입니다.

2.  영어 해석의 법칙화
〈심우철 합격영어 구문〉은 공무원/경찰직/소방직 시험에 등장하는 영어 문장을 법칙화하여 정확하게 해석하는 방법을 제시합니다. 누구나 구문을 쉽게 이해할 수 있고 체득할 수 있는 단순하고 체계적인 방법이 〈심우철 합격영어 구문〉에 실려 있습니다.

3. 구문 이해를 통한 빈출 영어 문법 정복
구문 학습을 통해 자주 출제 되는 문법 요소들 또한 쉽게 해결할 수 있습니다. 영어 해석법 공부와 더불어 공무원 영어 시험에 항상 등장하는 빈출 문법들도 〈심우철 합격영어 구문〉에서 완벽하게 대비하세요. 구문과 연결된 기출 문법 문항을 풀어봄으로써 영어 고득점에 한 걸음 더 다가갈 수 있습니다.",976,BOOK
부의 알고리즘 - 평범한 사람이 부자 되는 4단계 투자공식,이주영(상승효과) (지은이),2225,국내도서>경제경영>재테크/투자>재테크/투자 일반,9788947547253,누군가의 인생을 바꿀 수도 있다는 생각에 저자가 절심함을 담아 1년여의 시간을 들여 재테크의 모든 것과 반드시 부자 되는 과정을 모두 담았다. 지극히 평범한 우리가 해야 하는 일이기에 어려운 전문 용어나 미사여구를 쓰지 않고 직관적으로 쉽게 풀어냈다.,"자본소득이 노동소득을 추월한 시대에 평범한 우리를 경제적으로 자유롭게 해줄 수 있는 유일한 수단은 재테크이다. 너무 많이 들어서 당연한 소리인 것 같고, 나 역시 하고 있는 것만 같은 착각을 주는 단어 재테크. 과연 우리는 제대로 부자가 되는 길을 가고 있는 걸까? 《부의 알고리즘》의 저자는 십수 년간 금융권에서 일하며 돈과 금융에 대한 본질적 이해를 통해, 평범한 사람이 부자 되는 4단계를 거치지 않고서는 부자가 될 수 없음을 알게 되었다. 
부의 핵심인 시간을 확보하고 레버리지당하는 삶에서 레버리지하는 삶으로 변화하기 위해 과감히 직장을 그만둔 그는 유튜브를 비롯한 여러 매체를 통해 부자 되기를 꿈꾸는 많은 사람들을 만나고 있다. 그들에게 돈이 불어나는 과정, 부의 작동원리를 알려주고, 포트폴리오를 만들고 시스템화하기까지 재테크에 관한 모든 고민을 나눈다. 왜 우리는 부자가 되고자 하는지 근원적인 질문을 던지며, 실질적으로 부자가 되는 단계와 구체적인 방법을 공유하고 있는 것이다. 
《부의 알고리즘》 이 책은 누군가의 인생을 바꿀 수도 있다는 생각에 저자가 절심함을 담아 1년여의 시간을 들여 재테크의 모든 것과 반드시 부자 되는 과정을 모두 담았다. 지극히 평범한 우리가 해야 하는 일이기에 어려운 전문 용어나 미사여구를 쓰지 않고 직관적으로 쉽게 풀어냈다. 이제 우리가 해야 할 일은 실천뿐이다. 방향만 맞다면 반드시 부자 되는 부의 알고리즘을 통해 평범한 당신도 경제적 자유를 이루는 방법을 배울 수 있다.",617,BOOK
세상 어딘가에 하나쯤,유희경 (지은이),51371,국내도서>에세이>한국에세이,9791158161361,"시집서점 위트 앤 시니컬의 서점지기 유희경 시인이 서점에서 일어나는 소소하고 즐거운 이야기들을 묶어 펴냈다. 시인은 서점 안에 들어서 있는 물건들, 나선계단을 올라 서점에 입장하는 사람들, 서점이 위치한 혜화동의 풍경, 서점의 일들에 대해 썼다.
","이렇게 멋진 날에도, 
불을 켜고 손님을 기다리는 서점지기는 있어야지요

“지금의 생각과 감각 너머의 세계를
궁금해하고 있는 게 분명해”

당신은 바깥쪽에서 나는 안쪽에서
우리를 잇는 나의 작은 시집서점 위트 앤 시니컬,
그곳의 서점지기 유희경 시인의 이야기",670,BOOK
하이큐!! 44 - 최강의 적,후루다테 하루이치 (지은이),4133,국내도서>만화>본격장르만화>판타지>액션 판타지,9791136252982,,"괴변학파 요츠야 선배의 괴담의 후루타테 하루이치 신작!
이것이 바로 정통 스포츠 소년만화!!

동료들과의 특별한 만남과 흘러내리는 소중한 땀,
그리고 정상을 향한 목표!!

모두가 기다려왔던 '점프' 식 왕도 스포츠만화, 전격발매!!",5128,BOOK
디테일 사전 : 도시 편 - 작가를 위한 배경 연출 가이드,"안젤라 애커만, 베카 푸글리시 (지은이), 최세희, 성문영, 노이재 (옮긴이)",51538,국내도서>인문학>책읽기/글쓰기>글쓰기,9791155813607,"세상에 ‘평범한’ 배경은 없다. 《트라우마 사전》의 저자들이 알려주는, 빛나는 스토리를 완성시키는 장면 연출 가이드를 담은 책이다.","세상에 ‘평범한’ 배경은 없다!
《트라우마 사전》의 저자들이 알려주는, 빛나는 스토리를 완성시키는 장면 연출 가이드

바야흐로 ‘스토리’의 시대다. 소설, 드라마, 웹툰, 시나리오는 물론 이제는 스트리밍 서비스를 통한 오리지널 드라마와 영화까지 인기를 끌고 있다. 스토리의 수요가 높아진 만큼 개성 있고  매혹적인 이야기를 쓰고 싶어 하는 작가들은 점점 늘어나지만, 이들을 도와줄 기존의 작법서들은 대부분 캐릭터나 플롯을 다루는 데 치우쳐 있다. 전작 《트라우마 사전》을 통해 매력적인 캐릭터에게는 항상 트라우마가 있다는 점에 주목한 두 저자들은 이번에는 스토리텔링의 또 다른 요소에 집중한다. 바로 ‘배경’이다.

숙련된 작가들조차 배경을 단순히 이야기가 펼쳐지는 무대로만 생각한다. 장면에 딱 들어맞는 배경을 찾기 위해 고심하고, 공들여 묘사하기보다는 머릿속에 대충 떠오른 장소에 인물과 사건이 어울리기를 바란다. 하지만 독자들은 언제나 책에서 신선한 경험을 하고 싶어 한다. 《해리 포터》 시리즈의 호그와트 마법 학교, 《샤이닝》의 오버룩 호텔, 《헝거 게임》 시리즈의 캐피탈과 13구역 같은 배경이 없었더라면 이 작품들은 독자들의 머릿속에 깊이 각인되지 못했을 것이다. 

배경은 모든 장면에 깊이를 더하는, 스토리텔링에서 빠질 수 없는 요소이며 생각보다 훨씬 많은 일을 한다. 인물을 시험에 빠뜨리고, 과거의 상처를 끌어내고, 글의 분위기를 조성하며, 앞으로 일어날 사건을 암시한다. 꼭 화려하고 특별한 배경을 만들어야 한다는 뜻이 아니다. 《디테일 사전》의 가이드를 따라가다 보면 평범한 배경도 얼마든지 흥미롭게 바뀔 수 있다.  

이 시리즈는 생생한 배경을 연출할 수 있는 모든 방법을 제시한다. ‘시골 편’과 ‘도시 편’으로 분류된 각 권의 앞부분은 배경 연출에 대한 전반적인 이론을 담고 있다. 배경의 역할부터 디테일한 요소들을 선택해 배경을 연출하는 다양한 기법, 배경 묘사에서 주의할 점 등을 이해를 돕는 풍부한 예문과 함께 다루었다. 뒷부분에는 작가들이 배경으로 삼을 만한 장소들을 총망라했다. 글을 쓸 때 원하는 장소를 쉽게 펼쳐볼 수 있도록 ‘학교’, ‘자연과 지형’, ‘집’, ‘소매점’ 등으로 크게 분류했다. 세부 항목들에서는 각 장소에서 보고, 듣고, 느낄 수 있는 디테일한 감각들부터 장소에 대한 개괄적인 설명과 글쓰기에 참고가 될 예문까지 다양한 항목을 수록했다.

픽션이라고 느껴지지 않는 실감 나는 배경을 만들고 싶은가? 꼭 등장시키고 싶은 장소가 있는데 어떻게 그려야 할지 막막한가? 밋밋하거나 자꾸만 늘어지는 묘사 때문에 고민인가? 《디테일 사전》은 배경과 장면 연출에 대한 확실한 길잡이가 되어줄 것이다.",4730,BOOK
