title,author,genre_id,genre,ISBN,description_aladin,description_naver,salesPoint,mallType
모스크바의 신사,"에이모 토울스 (지은이), 서창렬 (옮긴이)",50919,국내도서>소설/시/희곡>영미소설,9788972758945,"뉴욕타임스 초장기 베스트셀러, 버락 오바마 전 미국 대통령이 2017년 추천도서로 소개해 화제가 된 소설. 2018년 상반기 현재 미국에서만 110만 부 이상 판매되었고, 「뉴욕타임스」 58주 베스트셀러 기록을 이어가고 있다.","세련되고 우아한 태도, 인간적 매력으로 무장한 채 메트로폴 호텔을 찾는 사람들의 마음을 사로잡는 백작!

버락 오바마 전 미국 대통령이 2017년 추천도서로 소개해 화제가 된 에이모 토울스의 소설 『모스크바의 신사』. 40대의 다소 늦은 나이에 첫 장편소설 《우아한 연인》을 발표하며 고전 문학을 연상시키는 작풍, 현대적이고 세련된 분위기, 매력 있는 등장인물을 잘 접목시킨 작품으로 상업적 성공과 문학적 성취를 모두 이뤄내며 괴물 신인으로 주목받은 저자가 4년 만에 발표한 두 번째 소설이다.

두 번의 혁명 이후 1920년대 러시아, 서른세 살의 알렉산드로 로스토프 백작은 모스크바의 메트로폴 호텔을 벗어날 경우 총살형에 처한다는 종신 연금형을 선고받는다. 프롤레타리아의 시대에서 제거되어야 마땅한 신분이지만 혁명에 동조하는 시를 쓴 과거의 공을 인정받아 목숨을 건진 백작. 거처를 스위트룸에서 하인용 다락방으로 옮기고 귀족으로서 누리던 모든 특혜를 회수당한 그이지만 메트로폴이 꼭 감옥인 것만은 아니었다. 

호텔은 백작의 세련되고 고상한 취향과 자상하고 긍정적인 성격을 지킬 수 있는 피난처이자 모험과 새로운 만남의 장소, 사랑과 우정을 키워나가는 좋은 집이기도 했다. 꼬마 숙녀의 놀이 친구, 유명 배우의 비밀 연인, 공산당 간부의 개인교사, 수상한 주방 모임의 주요 참석자로서 백작은 보란 듯이 새 삶에 적응해나간다. 날마다 새로운 손님과 사건이 끊이지 않는 혼란 속에서도 백작의 관심사는 호텔의 품격과 신사의 태도 유지, 소중한 사람들의 행복한 삶에 있다.

“재미있고, 영리하며, 놀라울 정도로 낙관적인 주인공이 등장하는 소설.
결코 잊을 수 없는 여정으로 당신을 인도할 것이다.”

_빌 게이츠, ‘2019년 여름 도서 추천‘에서",10636,BOOK
신헌의 PSAT for NCS 수리.자료해석 핵심 기본서 - 공기업 NCS 및 대기업 인적성 대비,"신헌, 위포트 연구소 (지은이)",34912,국내도서>수험서/자격증>PSAT (행정고시)>자료해석,9791161980454,"주요 공기업 필기시험에 출제된 PSAT형 문제 완벽 대비를 위한 자료해석 전문가 신헌의 수리.자료해석 핵심 기본서 개정판이다. 공기업 NCS 필기시험에 출제된 PSAT형 자료해석 적중 문제를 수록하였고, 신헌 선생님만의 문제 풀이 팁과 접근법을 제시한다.",,4121,BOOK
욕망의 진화,"데이비드 M. 버스 (지은이), 전중환 (옮긴이)",51514,국내도서>인문학>심리학/정신분석학>교양 심리학,9788983712073,"인간 남녀의 사랑, 연애, 섹스, 결혼의 실체를 밝히고자 머나면 과거로부터 현재에 이르기까지의 수백만 년에 걸친 인간 진화의 역사를 파헤치고 우리 마음 속 깊은 곳에 숨겨진 인간 본역의 성적 욕망을 낱낱이 드러낸 책. <위험한 열정, 질투>, <이웃집 살인마> 등으로 알려진 진화심리학자 데이비드 버스가 집필했다.","남녀의 엇갈린 욕망에 숨겨진 진실을 파헤치다

〈욕망의 진화〉는 인간 남녀의 서로 다른 욕망 아래 숨겨진 진화의 역사를 살펴보는 책이다. 1994년에 출간된 초판에 새로운 연구 성과를 덧붙인 2003년 개정판을 데이비드 버스의 제자이자 한국인 최초 진화심리학 박사인 전중환이 번역하였다. 남녀의 사랑, 연애, 섹스, 결혼의 실체를 밝히기 위해 먼 과거에서부터 현재에 이르기까지 수백만 년에 걸친 인간 진화의 역사를 파헤치고, 우리 마음 속 깊은 곳에 숨겨진 인간 본연의 성적 욕망을 드러낸다. 

이 책은 진화심리학이라는 창을 통해 인간의 내면을 들여다봄으로써, 그에 대한 궁금증을 해결할 수 있는 기회를 제공한다. 저자는 다윈의 성선택 이론을 적용하여, 남녀의 배우자에 대한 선호도와 배우자를 차지하기 위한 경쟁에서 사용하는 각종 전략들을 밝히고 있다. 50명의 공동 연구자들과 함께 6개 대륙과 5개 섬의 1만 47명의 남녀를 대상으로 설문 조사를 실시하였으며, 개정판에 덧붙여진 성적 질투에 대한 연구에는 한국인을 대상으로 실시한 설문 조사도 포함시켰다. 

이를 바탕으로 인간의 짝짓기와 연애, 섹스, 그리고 사랑이 근본적으로 전략의 일환이라고 주장한다. 바람직한 배우자를 두고 벌이는 치열한 짝짓기 전쟁에서 경쟁자를 제치고 성공적으로 짝짓기하는 데 따르는 여러 특정한 적응적 문제들을 해결할 수 있도록 인간의 심리 기제가 설계되었다는 것이다. 저자는 남녀가 짝짓기 과정에서 부딪혀 왔던 적응적 문제들을 파헤치며, 이를 해결하기 위해 진화해 온 복잡한 성 전략을 밝히고 있다.",21225,BOOK
보건교사 안은영,정세랑 (지은이),50993,국내도서>소설/시/희곡>한국소설>2000년대 이후 한국소설,9788937473098,"오늘의 젊은 작가 9권. &lt;지구에서 한아뿐&gt;, &lt;덧니가 보고 싶어&gt;, &lt;이만큼 가까이&gt;, &lt;재인, 재욱, 재훈&gt; 등의 소설을 출간하며 참신한 상상력과 따뜻한 이야기로 독자의 사랑을 받아 온 소설가 정세랑의 장편소설.","발랄하고 용감한 여전사이자 동시에 다정하고 유쾌한 언니, 안은영!

문학성과 다양성, 참신성을 기치로 한국문학의 미래를 이끌어 갈 신예들의 작품을 엄선한 「오늘의 젊은 작가」의 아홉 번째 작품 『보건교사 안은영』. 참신한 상상력과 따뜻한 이야기로 독자의 사랑을 받아 온 소설가 정세랑의 이번 작품은 수동적이지 않고 주체적이며, 감상적이지 않고 감각적인, 아는 형 삼고 싶은 사립 M고의 보건교사 안은영의 이야기를 담고 있다. 

특별한 것 없는 직업과 평범한 이름의 안은영은 보통의 보건교사가 아니다. 복 중의 복, 일복 하나는 타고난 그녀는 직업으로 ‘보건교사’ 역할에 충실하면서 동시에 자신만이 볼 수 있는 것들을 처치하고 쫓아내며, 또는 위로하는 ‘퇴마사’의 운명을 받아들인다. 여기에 사립 M고의 한문교사이자 학교 설립자의 후손인 홍인표에게 흐르는 거대한 에너지는 안은영의 활약을 돕는 필수적인 영양제 역할을 한다. 

에너지(기)를 보충하기 위해, 학교의 평화를 지키기 위해 둘은 내 거 아닌 내 것 같은 사이가 되어 힘을 합한다. 둘 앞에 나타나는 기이한 괴물들, 학생들에게 보이는 미스터리한 현상들, 학교 곳곳에 숨은 괴상한 힘들…… 사립 M고에는 어떤 비밀이 있는 것일까. 무엇보다 안은영과 홍인표의 썸(some)은 어떻게 마무리될까?",10563,BOOK
나의 첫 금리 공부 - 금리만 알아도 경제가 보인다,염상훈 (지은이),8587,국내도서>경제경영>경제학/경제일반>화폐/금융/재정,9791170430308,"누구나 궁금해하지만 아무도 쉽게 설명해주지 않는 금리에 관해 이야기해준다. 저자는 현재와 과거의 사례를 연관시켜 금리, 경제, 물가, 신용, 환율, 그리고 현재의 금융위기와의 관계를 설명한다.","나에게 맞는 적절한 자산을 선택할 수 있는 안목을 기르는 방법!

누구나 궁금해 하지만 아무도 쉽게 설명해주지 않는 금리에 관해 알려주는 『나의 첫 금리 공부』. 금리라는 무기를 통해 자본시장을 이해하고, 다양한 투자대상 중에서 자산을 지키고 이익을 얻는 냉철한 안목을 기를 수 있도록 도와주는 책이다. 저자는 현재와 과거의 사례를 연관시켜 금리, 경제, 물가, 신용, 환율, 그리고 현재의 금융위기와의 관계를 설명하며, 학교에서도 회사에서도 아무도 알려주지 않던, 관심도 없고 중요하게 여겨지지 않았던, 그러나 실은 매우 중요하고 흥미로운 금리를 알려준다.

파트 1에서는 금리에 대한 전반적인 지식을, 파트 2에서는 경기흐름에서 금리가 어떻게 작용하는지 알려준다. 파트 3과 파트 4에서는 물가와 금리, 신용과 금리의 관계를 다양한 사례로 설명한다. 파트 5에서는 우리나라의 원화뿐만 아니라 엔화, 위안화, 유로화 등을 통해 환율과 금리의 관계를 분석하고, 마지막 파트 6은 금융위기에서 금리가 어떤 역할을 하고 어떻게 영향을 미치는지 설명한다.",4314,BOOK
소드 아트 온라인 22 - J Novel,"카와하라 레키 (지은이), abec (그림), 박용국 (옮긴이)",51105,국내도서>소설/시/희곡>라이트 노벨>제이(J) 노벨,9791165018016,"『더 데이 비포』――《SAO》공략 도중, 키리토는 아스나에게 프로포즈하고, 두 사람은 신혼생활을 보내게 된다. 하지만 신혼집에 도착한 두 사람이 목격한 광경은, 예상을 한참 벗어나는 것이었는데……?","소드 아트 온라인의 주옥같은 에피소드들을 모은 단편집!
〈소드 아트 온라인 22 키스 앤 플라이〉

『더 데이 비포』――≪SAO≫ 공략 도중, 키리토는 아스나에게 프로포즈하고, 두 사람은 신혼생활을 보내게 된다. 하지만 신혼집에 도착한 두 사람이 목격한 광경은, 예상을 한참 벗어나는 것이었는데……?
『더 데이 애프터』――신생 ≪ALO≫에 새로운 아바타로 다이브한 이후, 아스나는 정체불명의 ≪이탈현상≫에 시달리고 있었다. 그 원인은 ≪SAO≫ 시절에 일어난 하나의 비극에 있었다――.
『무지개 다리』――해저신전에서 모험을 마친 키리토 일행. 하지만 바다의 왕 리바이어던과 심연의 왕 크라켄 간의 알 수 없는 대화는, 일행을 새로운 모험으로 초대한다!
『Sisters’ Prayer』――≪SAO 사건≫ 도중, 한 소녀가 의료용 풀다이브 기기 ≪메디큐보이드≫에 몸을 던졌다. ≪절검≫ 유우키, 탄생의 궤적이 드러난다.
소드 아트 온라인의 주옥 같은 에피소드들을 모은 단편집!",1319,BOOK
깨끗한 존경 - 이슬아 인터뷰집,이슬아 (지은이),51371,국내도서>에세이>한국에세이,9791196589141,"이슬아의 첫 번째 인터뷰집. 정혜윤, 김한민, 유진목, 김원영과의 긴 대화가 담겨 있다. 네 사람의 이야기를 보고 들은 뒤 감탄과 절망을 오가며 새로운 자신을 향해 나아간다. 2019년 &lt;일간 이슬아&gt; 시즌 2에 연재된 인터뷰 원고를 모아 다듬은 책이다.","이슬아의 첫 번째 인터뷰집. 정혜윤, 김한민, 유진목, 김원영과의 긴 대화가 담겨 있다. 네 사람의 이야기를 보고 들은 뒤 감탄과 절망을 오가며 새로운 자신을 향해 나아간다. 2019년 〈일간 이슬아〉 시즌 2에 연재된 인터뷰 원고를 모아 다듬은 책이다.",3858,BOOK
귀멸의 칼날 2,고토게 코요하루 (지은이),4133,국내도서>만화>본격장르만화>판타지>액션 판타지,9791134841331,"때는 다이쇼 시대. 숯을 파는 마음씨 착한 소년 탄지로의 일상은 가족들이 도깨비에게 몰살당하면서 돌변한다. 유일하게 살아남았으나 도깨비로 변모된 누이동생 네즈코를 원래대로 돌려놓기 위해, 가족을 죽인 도깨비를 응징하기 위해 탄지로와 네즈코는 길을 떠난다.","귀살대 입대 최종 선별에서 이형의 도깨비와 대치한 탄지로는 스승 우로코다키로부터 배운 기술로 맞선다. 과연 선발을 돌파할 것인가?! 그리고, 우로코다키 곁으로 돌아온 탄지로는 깨어난 네즈코와 함께 매일 밤 소녀가 사라진다는 마을로 향하는데…?!",6430,BOOK
콜레트는 죽기로 했다 13,"유키무라 알토 (지은이), 김명은 (옮긴이)",4134,국내도서>만화>본격장르만화>판타지>드라마틱 판타지,9791165019037,"드디어 서로의 마음을 확인할 수 있었던 콜레트와 하데스 님. 하지만 그것을 알게 된 해골들의 반응은? 그리고 디오를 도와주러 간 천계에서, 콜레트는 새로운 소동에 휘말리는데….","신은 제멋대로이긴 하지만
어딘지 인간미가 있어서 좋아―.

드디어 서로의 마음을 확인할 수 있었던 콜레트와 하데스 님. 하지만 그것을 알게 된 해골들의 반응은―? 그리고 디오를 도와주러 간 천계에서, 콜레트는 새로운 소동에 휘말리는데….",385,BOOK
2020 시나공 기출문제집 컴퓨터활용능력 2급 필기 - 핵심요약 + 동영상 강의 + 암기프로그램 + 기출CBT,"길벗 R&D, 강윤석, 김용갑, 김우경, 김종일 (지은이)",7006,국내도서>컴퓨터/모바일>활용능력>컴퓨터활용능력>컴퓨터활용능력 필기,9791160509908,"최근 5년간 출제된 최신 기출문제 15회분을 수록하고 문제마다 시험에 출제된 비율에 따라 A, B, C, D 등급을 지정하여 중요도를 표시했다. 개념과 함께 더 공부해야 할 문제, 문제와 지문을 외워야 할 문제, 답만 기억하고 넘어가라 문제들을 전문가가 꼼꼼히 알려준다.",,1830,BOOK
초등 필수 영단어 한 권으로 끝 - 교육부지정 800단어 + 주제별영단어 + 어원영단어 + 800단어 따라쓰기 (QR코드 및 MP3음원제공),이문필 (지은이),48930,국내도서>어린이>어린이 영어>어휘/단어,9791163400332,"초등영어과정에 꼭 필요한 교육부 지정 필수 800단어와 주제별 영단어, 필수 어원 영단어, 필수 영단어 따라쓰기를 학습함으로써 초등영어에서 가장 중요한 어휘력을 체계적으로 학습할 수 있다.","초등과정에 꼭 필요한 어휘학습을 한 권으로 끝낼 수 있어요!
『초등 필수 영단어 한 권으로 끝』은 초등영어과정에 꼭 필요한 교육부 지정 필수 800단어와 주제별 영단어, 필수 어원 영단어, 필수 영단어 따라쓰기를 학습함으로써 초등영어에서 가장 중요한 어휘력을 체계적으로 학습할 수 있습니다.

초등과정에 딱 맞춘 리얼 초등 영단어장! 
초등과정의 수준에 맞춰 단어별 뜻풀이는 초급수준으로 제시하였으며, 단어를 품사별로 구분하여 표기하고 품사별 활용예문을 통해 단어의 의미를 정확하게 파악할 수 있도록 하였습니다.
특히 영문발음기호 읽는 것에 어려움이 있는 학생들을 위하여 영문 및 한글발음을 병행표기를 하여 쉽고 재미있게 단어를 암기할 수 있습니다.
구성은 초등과정에서 꼭 필요한 교육부지정 800단어와 필수단어만으로는 부족한 주제별 영단어, 단어암기에 효율성과 확장성을 습득할 수 있는 어원영단어 중 중요 접두사와 접미사, 시험과 영어일기등 쓰기학습을 위한 필수단어 따라쓰기 등으로 구성되어 있습니다.",5142,BOOK
2020 전한길 한국사 경찰 4.0 실전 모의고사 Season 1,전한길 (지은이),34631,국내도서>수험서/자격증>공무원 수험서>7/9급 공무원>한국사>기출/문제집/모의고사,9791163717546,"출제위원급 전문 연구원들이 꼼꼼하게 감수하여 경찰 시험의 최신 이슈, 이론의 완결성, 출제 가능성, 출제 유형과 난이도 구성에 완성도를 높인 모의고사이다. 하프모의고사 10회, 실전동형 모의고사 10회를 100% 신규 문제로 구성한 개정판이다.",,417,BOOK
"걷는 사람, 하정우",하정우 (지은이),52905,국내도서>에세이>명사에세이>방송연예인에세이,9788954653817,"영화배우, 감독, 그리고 그림 그리는 사람. 스크린과 캔버스를 넘나들며 자신만의 활동을 펼쳐온 배우 하정우가 이번엔 새 책을 들고 에세이 작가로 찾아왔다. 문학동네에서 출간된 하정우 에세이의 제목은 &lt;걷는 사람, 하정우&gt;.","걷고 또 걷는 배우 그리고 자연인 하정우의 발자국!

하루 3만 보씩 걷고, 심지어 하루 10만 보까지도 기록한 적 있는 유별난 걷기 마니아로 알려진 배우 하정우의 에세이 『걷는 사람, 하정우』. 강남에서 홍대까지 편도 1만 6천 보 정도면 간다며 거침없이 서울을 걸어 다니고, 심지어 비행기를 타러 강남에서 김포공항까지 8시간에 걸쳐 걸어간 적도 있는 저자가 무명배우 시절부터 트리플 천만 배우로 불리는 오늘에 이르기까지 서울을 걸어서 누비며 출근하고, 기쁠 때나 어려운 시절에나 골목과 한강 변을 걸으면서 스스로를 다잡은 기억을 생생하게 풀어놓는다. 

조금 덜 먹고 덜 움직이기보다는 좋아하는 사람들과 이 세상의 맛있는 것들을 직접 두 손으로 요리해 먹고 두 발로 열심히 세상을 걸어 다니는 편을 택하겠다고 말하는 저자가 길 위에서 바라본 하늘, 노을, 무지개, 새벽 걷기의 쉼터이자 간이카페가 되어주는 한강 편의점, 함께 걷는 길동무, 종일 걸은 후에 직접 요리해 먹는 단순하지만 맛깔 나는 음식 등 소중한 일상의 조각들이 담겨 있다.

더불어 이 책에서 화려한 필모그래피 뒤에 숨어 있는 저자의 땀과 기도를 엿볼 수 있다. 사람들이 쉽게 성공과 실패의 양극단으로 나누어 단정지어버리는 순간조차 자신이 끝까지 걸어야 할 긴 여정의 일부라 믿으며 어떤 조건과 시선에도 흔들리지 않고 자신만의 보폭으로 앞으로 걸어가는 저자의 이야기를 통해 건강한 두 다리가 있다는 것에 감사하며 앞에 펼쳐진 길을 기꺼이 즐기면서 걸어가는 삶의 소중함을 느낄 수 있다.",15161,BOOK
마법의 설탕 두 조각,"미하엘 엔데 (지은이), 유혜자 (옮긴이)",48877,국내도서>어린이>동화/명작/고전>외국창작동화,9788935652792,"렝켄은 엄마 아빠가 자기 뜻을 전혀 존중해 주지 않는 것 같아 고민스럽다. 그 고민을 들은 요정은 렝켄에게 마법의 설탕 두 조각을 준다. 그걸 몰래 엄마, 아빠의 찻잔 속에 타 먹이면 엄마, 아빠가 렝켄의 말을 들어주지 않을 때마다 키가 반으로 줄어든다는 것이다.","엄마와 아빠를 어떻게 해야 좋을지 모르겠어요!

『마법의 설탕 두 조각』은 와 로 잘 알려져 있는 미카엘 엔데의 동화입니다. 엄마한테 신발 좀 빨아 달랬더니, 세상에, 다 컸다고 스스로 빨아 신으래요. 아빠한테 아이스크림 좀 사달랬더니, 많이 먹으면 배 아파서 안 된데요. 더할 나위 없이 온순한 아이 렝켄의 깜찍한 응징 작전이 시작됩니다. 빗물 거리의 요정을 찾아가서 마법의 각설탕 두 조각을 얻어 오면서부터, 렝켄의 엄마, 아빠에게는 황당한 일이 벌어집니다. 엄마, 아빠를 골탕먹인다고 정말로 렝켄이 행복해질 수 있을까요?",69946,BOOK
호모 데우스 - 미래의 역사,"유발 하라리 (지은이), 김명주 (옮긴이)",51549,국내도서>인문학>문화/문화이론>문명/문명사,9788934977841,"인류는 어디로 갈 것인가. &lt;사피엔스&gt; 저자 유발 하라리의 후속작. 역사의 시간 동안 인류의 가장 큰 과제이던 굶주림, 질병 그리고 전쟁을 밀어내고 그 자리를 차지한 것은 무엇인가? 10만 년간 지속되어온 호모 사피엔스의 믿음을 한순간에 뒤엎은 역사 탐구서이다.","출간 7주년·80쇄·55만부 기념
유발 하라리 특별 서문 수록
“평화와 번영의 시대가 이렇게 빨리 끝날 거라고는 예상하지 못했다”

《사피엔스》는 우리가 어디에서 왔는지 알려주고
《호모 데우스》는 우리가 어디로 가는지 알려준다!
“도발적이다! 천재 사상가의 문제작.” (뉴욕타임스)

‘천재 사상가’(뉴욕타임스) 유발 하라리의 문제작 《호모 데우스》. 대표작 《사피엔스》와 더불어 인문교양 분야의 트렌드를 주도하며 2023년 1월 기준 ‘80쇄 발행·55만부 판매’라는 기록적인 성적을 거두고 있다. 전 세계적으로는 50개 국어로 출간되어 1,000만부 이상 팔려 글로벌 베스트셀러로 자리매김한 지 오래다.
책 서두에는 어느 때보다 어려운 상황을 맞고 있는 현재 인류에게 필요한 것이 무엇인지 제언하는 특별 서문이 수록되었다. 기후위기와 코로나 팬데믹, 미·중 패권 경쟁과 러시아의 우크라이나 침공, 기술혁신의 명암과 날로 심해지는 양극화, 그리고 세계 곳곳에서 목격되는 민주주의 붕괴와 장기 경기침체 조짐까지. 난국을 헤쳐나가기 위해 무엇을 해야 할까? 위기 상황을 헤쳐나가기 위해 동료 사피엔스에게 전하는 호소가 특별 서문에 담겨 있다.",36317,BOOK
라틴어 수업 - 지적이고 아름다운 삶을 위한,한동일 (지은이),51378,국내도서>인문학>교양 인문학,9788965962205,"한국인 최초, 동아시아 최초 바티칸 대법원 로타 로마나 변호사이자 가톨릭 사제인 한동일 교수가 2010년부터 2016년까지 서강대학교에서 진행했던 강의를 책으로 옮겼다. 책 말미에는 수업을 들었던 제자들이 책 출간을 기념해 보내온 편지를 함께 실었다.","한국인 최초 바티칸 대법원 변호사 한동일의 화제의 명강의를 책으로 만난다!

『라틴어 수업』은 한국인 최초, 동아시아 최초 바티칸 대법원 로타 로마나(Rota Romana) 변호사이자 가톨릭 사제인 한동일 교수가 2010년 하반기부터 2016년 상반기까지 서강대학교에서 진행했던 '초급·중급 라틴어' 수업의 내용을 정리하여 엮은 책이다. 서강대학교 학생들뿐만 아니라 입소문을 타고 연세대, 이화여대를 비롯해 신촌 대학가를 벗어난 지역 학교 학생들과 일반인들까지 찾아와 늘 강의실이 만원이었던 저자의 강의 내용을 직접 만나볼 수 있다.

저자의 강의는 단순한 어학 수업에 그치지 않고 라틴어의 체계, 라틴어에서 파생한 유럽의 언어들을 시작으로 그리스 로마 시대의 문화, 사회 제도, 법, 종교 등을 포함해 오늘날의 이탈리아에 대한 이야기까지 담고 있다. 또한 저자가 유학 시절 경험했던 일들, 만난 사람들, 공부하면서 겪었던 좌절과 어려움, 살면서 피할 수 없었던 관계의 문제, 자기의 장점과 단점에 대한 성찰 등 우리 삶에 맞닿아 있는 화두들이 함께 녹아 있어 단순한 라틴어 강의가 아닌 종합 인문 교양 수업에 가깝다. 

한 예로, 라틴어 ‘도 우트 데스(Do ut Des)’는 ‘네가 주면 나도 준다’라는 뜻으로 로마법의 채권 계약에서 나온 법률적 개념이지만 저자는 이 말을 통해 과거 로마법상 계약의 기준이 되는 네 가지 도식에서부터 유럽의 세속주의와 상호주의에 이르기까지 이야기를 풀어나간다. 나아가 상호주의 원칙이 흔들리는 오늘날의 국제 사회에서 이 개념이 왜 과거의 것으로 머무르지 않고 현재에도 중요한지 설명한다. 이처럼 저자가 우리에게 들려주는 이야기는 결국 우리 자신에게 돌아와 살아가면서 한번쯤 생각해봐야 할 화두들에 대해 고민하고 생각해보게 만드는 단초가 되어준다.",30504,BOOK
