title,author,genre_id,genre,ISBN,description_aladin,description_naver,salesPoint,mallType
평균의 종말 - 평균이라는 허상은 어떻게 교육을 속여왔나,"토드 로즈 (지은이), 정미나 (옮긴이), 이우일 (감수)",51121,국내도서>사회과학>교육학>교육 일반,9788950963613,"ADHD 장애 자퇴생에서 하버드대 교수로, 토드 로즈가 발견한 ‘개개인성’의 힘. 학교 제도 속의 ‘문제아’였던 토드 로즈는, 탄탄한 과학적 이론을 통해 ‘평균’이라는 기준 자체가 잘못된 허상에서 비롯되었음을 지적한다.","허상에서 비롯된 ‘평균’에서 벗어나 새로운 교육을 설계해야 한다!

하버드 교육대학교 교수이자 교육신경과학 분야의 선도적인 사상가 토드 로즈가 이제껏 교육을 속여 온 ‘평균’이라는 허상을 깨부수는 『평균의 종말』. ADHD 장애가 있는 저자는 학교에서 요구되는 평균적인 지능을 가진 학생도, 평균적인 성격을 지닌 학생도 아니었기에  모난 돌이 되어 학교를 떠나야 했다. 학교 제도 속의 문제아로, 학교에서 인정받지 못했던 저자는 오히려 학교를 벗어나면서 인생 반전을 맞게 됐다. 

학교 안에서는 발견하지 못했던 재능을 발견했고, 주입식 수업 대신 자신에게 맞는 학습법을 찾아 흥미로운 분야를 공부했고, 이제는 교육학 최고 권위자로 꼽히는 세계적 인물이 되어 자신과 같이 평균이라는 허상에 가려져 인정받지 못한 아이들을 위해 연구를 이어가고 있다. 저자는 이 책에서 평균적인 재능, 평균적인 지능, 평균적인 성격이란 실재하지 않으며, 탄탄한 과학적 이론을 통해 심지어 그 같은 개념이 완전히 잘못된 허상임을 밝힌다. 

아이들은 저마다 타고난 재능이 다르다. 암기력이 좋은 아이가 있는가 하면 상황 판단이 빠른 아이가 있고, 수리적 이해가 높은 아이가 있는가 하면 예술적 감각이 뛰어난 아이가 있다. 그러나 공교육은 그 같은 다차원적인 개개인성을 무시하고, 연령별 평균적 지능이라는 기준에 따라 학습 과목과 난이도를 정해놓고는, 그 아이의 점수가 평균 점수보다 높은지 낮은지만 보면 모든 재능을 알 수 있다는 결론을 내린다.

저자는 시대가 바뀌면 교육도 바뀌어야 한다고 이야기하며 학교를 지배하는 평균주의의 함정에서 벗어나 아이들 각자를 창조적 인재로 키울 수 있도록, 혁신적인 교육법과 평가법을 제안한다. 4차 산업혁명 시대가 되면서 창조적 인재가 필요한 지금, 창의성을 죽이는 주입식 교육도, 재능을 평가하는 방법도 달라져야 한다는 것이다. 아이의 타고난 재능을 발견해 능력을 발휘하도록 가르치는 일이 무엇보다 중요하다고 강조하면서 이 책을 통해 새로운 교육을 위한 설계도를 그리는 데 견고한 이론적 토대를 마련해준다.",7422,BOOK
기생충 각본집 & 스토리보드북 세트 - 전2권,봉준호 (지은이),51051,국내도서>예술/대중문화>영화/드라마>한국영화,9791196076061,"2019 칸 국제영화제 황금종려상을 수상하며 한국 영화 100주년인 2019년, 대한민국 영화계와 영화팬들에게 뜻 깊은 선물을 안겨준 봉준호 감독의 영화 '기생충' 각본집과 스토리보드북(콘티집)가 각각의 단행본으로 출간된다.","세계를 놀라게 한 봉준호 감독의 예술 작품 《기생충》의 시작!

제72회 칸 국제영화제 황금종려상을 수상하며 한국 영화 100주년인 2019년 대한민국 영화계와 영화팬들에게 뜻 깊은 선물을 안겨준 봉준호 감독의 영화 《기생충》 각본집과 스토리보드북(콘티집)을 함께 수납할 수 있는 특별한 독점 아트워크의 북케이스를 제공하는 『기생충 각본집 & 스토리보드북 세트』.

《살인의 추억》, 《괴물》, 《마더》 등 작품성과 대중성을 모두 사로잡은 괴물 같은 작품들로 한국 영화사에 선명한 궤적을 남겨온 봉준호 감독은 《기생충》을 통해 “봉준호는 마침내 장르가 되었다”는 극찬을 받으며 제72회 칸 국제영화제 황금종려상을 수상하며 세계적 거장으로 새삼 인정받았다. 

전원백수인 기택네 장남 기우가 고액 과외 면접을 위해 박사장네 집에 발을 들이면서 시작된 두 가족의 만남이 걷잡을 수 없는 사건으로 번져가는 이야기를 담은 영화 《기생충》은 봉준호 감독의 전매특허와도 같은 사회에 대한 날카로운 통찰, 허를 찌르는 상상력, 코미디와 스릴러, 호러 등 각종 장르가 버무려져 보는 이를 단숨에 몰입시키는 충격적인 재미를 선사한다. 

《기생충》의 각본과 스토리보드는 봉준호 감독이 직접 쓰고 그렸다는 점에서 더욱 특별하다. 영화의 스토리보드를 전문 작가에게 맡기지 않고 직접 그리는 것으로도 유명한 봉준호 감독의 머릿속에만 존재하던 《기생충》은 어떻게 봉준호 자신에 의해 종이 위의 스케치가 되어 영화의 뼈대가 되었는지, 스태프와 배우들이 영화에 살을 붙이기 직전 단계의 모습을 이 스토리보드를 통해 확인할 수 있다. 각본집에는 영화전문기자이자 작가인 이다혜 씨네21 기자가 진행한 인터뷰를 담아 각본이라는 문학적 장르와 글 쓰는 사람 봉준호에 초점을 맞춰, 새로운 각도에서 그의 영화 세계를 들여다볼 수 있는 계기를 마련해준다.",11126,BOOK
"아무튼, 술 - 오늘의 술을 피하기 위해서 우리는 늘 어제 마신 사람이 되어야 한다",김혼비 (지은이),180236,국내도서>에세이>음식에세이,9791188343225,"아무튼 시리즈의 스무 번째 이야기는 '술'이다. &lt;우아하고 호쾌한 여자 축구&gt;의 김혼비 작가가 쓴 두 번째 에세이로, '생각만 해도 좋은 한 가지'에 당당히 ""술!""이라고 외칠 수 있는 세상 모든 술꾼들을 위한 책이다.","『우아하고 호쾌한 여자 축구』 김혼비의 신작
술술 넘기다 보면 어느새 마음이 술렁인다!

아무튼 시리즈의 스무 번째 이야기는 ‘술’이다. 『우아하고 호쾌한 여자 축구』의 김혼비 작가가 쓴 두 번째 에세이로, ‘생각만 해도 좋은 한 가지’에 당당히 “술!”이라고 외칠 수 있는 세상 모든 술꾼들을 위한 책이다. “술을 말도 안 되게 좋아해서 이 책을 쓰게” 된 작가는 수능 백일주로 시작해 술과 함께 익어온 인생의 어떤 부분들, 그러니까 파란만장한 주사(酒史)를 술술 펼쳐놓는다.

소주, 맥주, 막걸리부터 와인, 위스키, 칡주까지 주종별 접근은 물론 혼술, 집술, 강술, 걷술 등 방법론적 탐색까지… 마치 그라운드를 누비듯 술을 둘러싼 다양한 세계를 종횡무진 넘나드는 작가를 좇다 보면 아직 경험해보지 않은 주종과 방법을 시도해보고 싶은 애주가나 여태 술 마시는 재미도 모르고 살았다는 기분이 드는 비애주가 할 것 없이 모두가 술상 앞에 앉고 마는, 술이술이 마술에 빠지게 된다.",11970,BOOK
문장의 일 - 지적 글쓰기를 시작하는 사람들에게,"스탠리 피시 (지은이), 오수원 (옮긴이)",51538,국내도서>인문학>책읽기/글쓰기>글쓰기,9791155812426,실용적인 글쓰기 지침서이자 아름다운 문장들의 세계로 이끄는 안내서이며 ‘텍스트 생산자’로서 독자를 위한 독서법 책이다.,"독자이자 작가인 우리들의 문장을 위하여

우리는 매일 문장을 읽고 쓴다. 보고서, 기획안, 소설, 기사부터 SNS 게시물, 메일, 개인 톡까지. 어떻게 하면 한 문장이라도 나답게 잘 쓸 수 있을까?
미국을 대표하는 문학 비평가이자 법대 교수 스탠리 피시는 ‘문장은 모든 것’이라고 말한다. 문장은 생각을 담은 최소 단위이며 가장 핵심 단위이므로, ‘문장의 힘’은 상상 이상이다. 그러나 현실은 암담하다. 대학에 입학한 학생들의 글쓰기 능력에 충격을 받은 그는 ‘문장 읽는 법’부터 ‘문장 쓰는 법’까지 문장에 관한 글을 쓰기 시작했고, 이 책이 그 땀의 결과물이다. 『문장의 일』은 2011년 출간 즉시 ‘뉴욕 타임스 베스트셀러’에 올랐고 현재까지도 ‘지적 글쓰기’를 시작하는 사람들에게 필독서로 널리 읽히고 있다. 스탠리 피시의 방법론은 간단명료하다. 뛰어난 문장을 많이 읽고, 왜 뛰어난지 알아내고, 그런 문장을 쓰기 위한 모방 훈련을 지속하라는 것.",4583,BOOK
2주 만에 끝내는 해커스 오픽 OPIc START (Intermediate 공략) - 스피킹 초보를 위한 OPIc 필수 학습서 | 기초에서 실전 시험까지 Intermediate 등급 2주 완성,해커스 오픽연구소 (지은이),49947,국내도서>외국어>OPIc/인터뷰 영어>OPIc,9791158551988,"스피킹 초보를 위한 OPIc 학습서이다. 최신 OPIc Background Survey 항목을 반영하였으며 2주 만에 Intermediate 등급 달성 가능한 체계적인 학습 구성과 실전에서 바로 쓰는 ‘핵심 답변 패턴’, 실제 시험장에서 활용할 수 있는 ‘모범 답변 및 아이디어’ 수록하였다.","『해커스 OPIc START(Intermediate 공략)』 은 스피킹 초보를 위한 OPIc 학습서이다. 최신 OPIc Background Survey 항목을 반영하였으며  2주 만에 Intermediate 등급 달성 가능한 체계적인 학습 구성과 실전에서 바로 쓰는 ‘핵심 답변 패턴’, 실제 시험장에서 활용할 수 있는 ‘모범 답변 및 아이디어’ 수록하였다.",11973,BOOK
진혼 1~3 세트 - 전3권 (완결),Priest (지은이),181727,국내도서>소설/시/희곡>로맨스소설>국외 BL,9791101756996,"사람이 아닌 것이 벌인 사건을 해결하는 특수조사처. 특수조사처의 처장 자오윈란은 룽청대 대학교수 션웨이에게 첫눈에 반한다. 그의 고백은 단칼에 거절당하지만, 션웨이의 마음을 확신한 자오윈란은 쉽게 포기하지 않는다.","“난 동그란 건 다 싫어. 삶과 죽음이 끝도 없이 반복되는 것 같잖아.”

사람이 아닌 것이 벌인 사건을 해결하는 특수조사처. 특수조사처의 처장 자오윈란은 룽청대 대학교수 션웨이에게 첫눈에 반한다. 그의 고백은 단칼에 거절당하지만, 션웨이의 마음을 확신한 자오윈란은 쉽게 포기하지 않는다. 

“이건 단순한 우연이 아니라, 운명이 정해준 인연 같네!”

짙은 안개에 가려진 션웨이의 진짜 정체는 무엇일까? 저승의 성물인 윤회구와 산하추를 노리고 있는 이는 누구인가? 수많은 윤회를 거듭한 지독한 사랑의 서사시와 4대 성물을 구해내기 위한 퇴마기가 지금 시작된다. 

드라마 〈진혼〉 원작 소설
*본 소설은 대만판(번체) 기준으로 출간되었습니다.",1121,BOOK
경매 권리분석 이렇게 쉬웠어? - 생초보도 할 수 있는 초간단 권리분석법 대공개!,"박희철 (지은이), 송희창 (감수)",175,국내도서>경제경영>재테크/투자>부동산/경매,9791187799078,"대부분의 초보들이 권리분석 공부가 어려워 경매 투자를 중도 포기하는데, 그것은 권리분석이 어려워서가 아니라 어렵게 공부하기 때문이다. 저자는 그동안 자신이 직접 투자했던 물건을 바탕으로, 실수하지 않고 쉽게 권리분석하는 방법과 쉬운 물건만으로도 부를 쌓은 자신의 노하우를 진하게 담아냈다.","이 책 한 권만 읽어도 쉬운 물건으로 수익내기가 가능하다!
대한민국에서 가장 쉽고, 체계적인 권리분석 책!

권리분석이 어렵다고??
실전 투자자가 알려주는 가장 쉽고, 가장 체계적인 초간단 권리분석법!
이제 초보도 권리분석을 쉽게 정복하고, 쉽게 수익낼 수 있다.

대부분의 초보들이 권리분석 공부가 어려워 경매 투자를 중도 포기하는데, 그것은 권리분석이 어려워서가 아니라 어렵게 공부하기 때문이다. 책의 저자는 그동안 자신이 직접 투자했던 물건을 바탕으로, 실수하지 않고 쉽게 권리분석하는 방법과 쉬운 물건만으로도 부를 쌓은 자신의 노하우를 진하게 담아냈다.

경매 투자로 성공하려면 공부단계에서 멈추지 않고 첫 수익을 맛봐야만 한다. 실제 수익을 경험하기 위해서 공부는 쉽고 재밌게 해야 하는 것이다. 이 책을 정복한다면 당신은 고수익의 경매 투자의 길로 나아갈 수 있다.",22052,BOOK
페파피그 미니 알파벳 스티커북,펭귄랜덤하우스코리아 편집부 (지은이),35148,국내도서>유아>유아 교양/학습>유아영어>영어학습,8809505530270,"애니메이션에 나오는 귀여운 페파피그 스티커와 다양하게 활용할 수 있는 알파벳 대문자, 소문자 스티커, 영어 단어 스티커가 들어 있으며, 스토리가 담긴 주제별 음식, 파티, 장난감, 탈것 스티커도 가득 담겨 있다.","귀여운 페파피그를 미니 알파벳 스티커로 만나 보세요!

페파피그 미니 알파벳 스티커북에는 애니메이션에 나오는 귀여운 페파피그 스티커와 다양하게 
활용할 수 있는 알파벳 대문자, 소문자 스티커, 영어 단어 스티커가 들어 있어요. 스토리가 담긴 
주제별 음식, 파티, 장난감, 탈것 스티커가 가득 담겨 있어요. 

[특징]
1.귀여운 페파피그 스티커와 알파벳 대문자, 소문자 스티커가 들어 있어요!
2.음식, 장난감, 탈것, 음악, 동물, 식물 등 스토리가 담긴 주제로 스티커를 구성했어요!
3.그림 영어 단어 스티커, 꾸미기 스티커가 들어 있어서 다양하게 활용할 수 있어요!
4.알파벳 칭찬 스티커와 칭찬 스티커판도 들어 있어요!",3217,BOOK
대한민국 땅따먹기 - 진짜 부자가 되고 싶다면 토지에 투자하라!,서상하 (지은이),175,국내도서>경제경영>재테크/투자>부동산/경매,9791187799115,"저자는 지난 5년간 토지 투자로 약 30억 원 이상 투자 수익을 올리며 지금까지 실전에서 부딪치며 자신만의 노하우를 만들어 왔다. 그런 노하우를 이 한 권의 책에 모두 담아았다. 토지 투자의 포인트는 ‘건물을 지을 수 있는 토지인가’를 판별하는 것, 즉 돈 되는 토지를 골라내는 것이다.","“진짜 부자는 토지로 만들어 진다!”
최고의 실전 투자자가 공개하는 ‘돈 되는 토지 골라내기’ 노하우!

‘조물주 위에 건물주’라는 우스갯소리가 유행처럼 번진 요즘, 부동산 경매 시장의 경쟁률이 굉장히 치열해졌다. 그러나 이런 치열한 경쟁 속에서 유독 자유로운 분야가 있는데, 이는 바로 토지 경매이다. 경쟁률이 적은 만큼 나에게 돌아오는 수익은 크다.
“수익을 올리려면 남들과 다른 시각을 가져야 한다.”

경매에 처음 입문한다면, 수익이 보장된 토지 분야에서 시작하라

어느 부동산보다 안정적이고 고수익을 내게 해주는 투자 수단이 바로 ‘토지’이다. 토지가 어렵다고 생각된다면 이 책을 꼭 읽어라. 실전 투자에서 필요한 지식은 몇 가지로 정해져 있어 어려울 이유가 없다.

토지 투자는 돈이 많아야 할 수 있다고? 절대 아니다.

소액으로도 얼마든지 좋은 수익을 낼 수 있는 분야가 바로 ‘토지’ 경매이다.
기억하라. 부자들이 토지에 투자하는 것이 아니라, 그들은 토지에 투자해서 부자가 되었음을.",5009,BOOK
영단기 신토익 스타트 RC,정재현 (지은이),49854,국내도서>외국어>토익>Reading,9791156177845,신토익 시행 후의 최신 경향과 새로 출제되는 문제 유형을 철저하게 분석하여 기초 학습자들에게 꼭 필요한 145개의 토익 대표 문장을 선별하였다.,"『영단기 신토익 스타트 RC』는 신토익 시행 후의 최신 경향과 새로 출제되는 문제 유형을 철저하게 분석하여 기초 학습자들에게 꼭 필요한 145개의 토익  대표 문장을 엄선하여 수록하였다. STEP 1. 개념 정리 - STEP 2. 유형 훈련 - STEP 3. 실전 훈련 순의 단계별 학습과  약점을 보완하는 연습 훈련, 모든 내용 설명 페이지에는 오른쪽에 보조단을 따로 두어 학습에 도움이 되는 요소들을 추가로 정리하여 제공한다.",6218,BOOK
스무고개 탐정 11 : 탐정 대회 2부,"허교범 (지은이), 고상미 (그림)",48874,국내도서>어린이>동화/명작/고전>국내창작동화,9788949195957,"「스무고개 탐정」 시리즈 열한 번째 이야기. 스무고개 탐정은 물론 주변 여러 사람의 운명이 함께 걸려 버린 탐정 대회, 그 마지막 이야기다. 탐정 대회 예선의 여러 고비를 무사히 넘겨 당당히 본선에 올라온 문양이를 기다리고 있는 건 ‘스무고개 탐정의 실종’ 이라는 엄청난 소식이다.","스무고개 탐정이 사라졌다! 
그날 그 폭포에서 무슨 일이 있었던 걸까? 
여러 사람의 운명이 걸린 탐정 대회, 그 마지막 이야기",2490,BOOK
침묵이라는 무기 - 의도적으로 침묵할 줄 아는 사람만이 원하는 것을 갖는다!,"코르넬리아 토프 (지은이), 장혜경 (옮긴이)",70216,국내도서>자기계발>성공>성공학,9788957360217,침묵을 통해 말에 무게를 싣는 법을 알려준다. 핵심은 “말 대신 침묵하라”가 아니라 “말의 양을 조절하여 침묵을 효과적인 설득의 수단으로 사용하자”는 것이다. 주변에 자신감 넘치고 믿음직하며 존경을 받는 인물을 떠올려보라. 그들은 말을 아낄 것이다. 그래서 그들의 말에는 무게가 있다.,"침묵을 통해 말에 무게를 싣는 방법!

침묵도 소통의 방식이다. 말과 침묵은 서로를 보완하고, 말과 침묵의 균형이 중요하다. 또한 침묵은 효과가 강렬하다. 그래서 말이 적으면 지적인 인상을 풍긴다. 깊이 있는 인간의 아우라가 바로 침묵의 결과인 셈이다. 우리는 말의 홍수에서 살고 있다. 말을 많이 하는 사람 중에는 자기가 무슨 말을 하는지조차 모르는 경우도 많다. 어째서일까? 결론을 말하자면, 침묵의 힘을 모르기 때문이다.

『침묵이라는 무기』에서 저자는 말의 양을 조절하여 침묵을 효과적인 설득의 수단으로 사용해야 한다고 이야기한다. 침묵하고, 말을 아끼는 이들의 말에는 무게가 있고, 침묵할 줄 안다면 인격의 성장과 정신적 깨달음까지 얻을 수 있으며, 침묵으로 세상과 거리를 두면 역설적이게도 더 세상에 다가갈 수 있다고 이야기하면서 51가지의 침묵 도구를 제시한다. 이를 적절하게 사용해 누군가와 논쟁을 하거나 협상을 할 때 그 어떤 상황도 유리하게 이끌어 낼 수 있도록 도와준다.",1589,BOOK
"디커플링 - 넷플릭스, 아마존, 에어비앤비… 한순간에 시장을 점령한 신흥 기업들의 파괴 전략","탈레스 S. 테이셰이라 (지은이), 김인수 (옮긴이)",2173,국내도서>경제경영>기업 경영>경영전략/혁신,9791189995379,"기존 기업이 신생 기업의 디커플링 공격에 대응하는 방법은 물론이고, 디커플링 공식을 자신의 비즈니스에 도입해 사업 모델을 혁신하는 법, 에어비앤비 같이 파괴적인 스타트업을 꾸리는 법까지, 수백 개 기업 사례를 근거로 대단히 실전적인 로드맵을 제시한다.","시장 파괴의 주범은 기술이 아닌 고객이다!

하버드 경영대학원 테이셰이라 교수가 8년간 수백 개 대기업과 신흥 기업을 찾아다니며 실사례를 분석하는 집요한 연구 끝에 내놓은 경영전략서 『디커플링』. 저자는 대단한 기술도 없어 보이는 우버, 에어비앤비 등 신흥 강자가 시장 판도를 뒤바꾸는 방식에 공통 패턴이 있음을 발견했다. 바로, 디커플링(decoupling)이다.

디커플링은 말 그대로 분리하기, 해체하기, 끊어내기이다. 고객의 소비 활동 사이에 존재하는 연결고리인 제품 탐색, 평가, 구매, 사용 중 약한 고리를 끊고 들어가 그 지점을 장악하는 디커플링으로 공룡 기업이 된 이들의 사례를 살펴보면 사고의 초점을 기업이 아닌, 기술이 아닌, 고객에 맞추고 있었다. 공격적인 디커플러(decoupler)들은 재빨리 고객의 불편한 소비 단계를 낚아채 빠른 속도로 시장을 장악했다.

저자는 파괴적 혁신 이론이 더 이상 유효하지 않다고 이야기하며 기존 기업이 신생 기업의 디커플링 공격에 대응하는 방법은 물론, 디커플링 공식을 자신의 비즈니스에 도입해 사업 모델을 혁신하는 법, 에어비앤비 같이 파괴적인 스타트업을 꾸리는 법까지, 수백 개 기업 사례를 근거로 대단히 실전적인 로드맵을 제시해 누구나 디커플링을 일으키는 디커플러가 될 수 있도록 도와준다.",3867,BOOK
사랑의 기술,"에리히 프롬 (지은이), 황문수 (옮긴이)",51381,국내도서>인문학>인문 에세이,9788931011623,"프롬은 가장 능동적으로 자신의 퍼스낼리티 전체를 발달시켜 생산적 방향으로 나아가지 않는 한, 아무리 사랑하려고 노력해도 반드시 실패하기 마련이며, 이웃을 사랑하는 능력이 없는 한, 또한 참된 겸손, 용기, 신념, 훈련이 없는 한 개인적인 사랑도 성공할 수 없다고 말한다.","에리히 프롬의 마지막을 함께한 라이너 풍크 박사의 
《사랑의 기술》 50주년 기념판에 부치는 글 수록

‘사랑’은 기술인가  독일 태생의 정신분석학자이자 사회철학자인 에리히 프롬은 《사랑의 기술》에서 인류의 영원한 화두인 사랑에 대해 질문을 던진다. 프롬이 던진 이 질문은 《사랑의 기술》이 출간된 지 60여 년이 지난 지금까지도 많은 독자들에게 사랑의 의미를 진지하게 돌아볼 수 있는 계기를 제공했다. 《사랑의 기술》이 얼마나 많은 독자들에게 영향을 미쳤는지는 1956년 첫 출간 이후 34개 언어로 번역되었다는 사실과, 전 세계에서 수백만 부 이상 판매되면서 우리 시대의 대표적 스테디셀러이자 현대의 고전으로 자리 잡았다는 사실만 봐도 알 수 있다. 문예출판사에서는 이번에 새로운 표지로 바꾼 《사랑의 기술》 개정판을 출간했다.",33210,BOOK
"VOCA Extreme 2.0 - 공무원 영어 최빈출 어휘 2,000개 + @",심우철 (지은이),34626,국내도서>수험서/자격증>공무원 수험서>7/9급 공무원>영어>단어/문법/독해 외,9791162050569,"단 한 권으로 공무원 어휘에 대한 철저한 대비가 가능한 교재다. 공무원 시험 10개년간의 기출분석과 공무원 시험을 수년간 분석해온 심우철 선생님의 노하우를 통해 출제 빈도가 매우 높은 2,000개의 표제어를 엄선해서 수록하였다.","1. 공무원 시험을 위한 최적의 단어장
 단 한 권으로 공무원 어휘에 대한 철저한 대비가 가능합니다. 공무원 시험
10개년간의 기출분석과 공무원 시험을 수년간 분석해온 심우철 선생님의 노하우를 통해 출제 빈
도가 매우 높은 2,000개의 표제어를 엄선해서 수록하였습니다.

2. 어휘의 초고효율 학습을 위한 구성
이번 에서는 표제어를 3,800개에서 2,000개로 절반 가량을 줄여 학습의 부
담감은 줄이고 휴대의 편리성은 높였습니다. 하지만 표제어에 들어가지 못한 나머지 단어들은 동
의어와 파생어로 자연스럽게 녹아들어 있기에 수험생들의 학습량에 전혀 부족함이 없습니다.

3. 도식화된 어원 설명과 연상을 활용한 단어 학습
영어 단어 학습에서 어원이 가지는 역할은 상당히 큽니다. 표제어 옆에 어원을 도식화시켜서 어
근, 접두사, 접미사를 중심으로 나눈 뒤 친절하게 설명까지 덧붙였습니다. 이를 통해 학습자들은
단어를 가장 효과적으로 암기할 수 있습니다. 또한 어휘의 발음과 형태를 이용한 연상 설명으로
단어 학습의 흥미를 높이고 강력한 암기 효과를 얻을 수 있습니다.

4. 반복적인 동의어 학습
공무원 수험생들이 단어를 외울 때 가장 힘들어하는 부분이 바로 방대한 양의 동의어 암기입니
다. 은 표제어로 나온 단어가 다른 표제어의 동의어로 여러 차례 등장하도록
편집되었습니다. 따라서 의미를 까먹었을 법한 단어들이 다른 단어의 동의어로 자주 등장하기에
반복적인 학습이 가능하고 그로 인해 장기적으로 어휘를 기억할 수 있습니다.",1983,BOOK
