title,author,genre_id,genre,ISBN,description_aladin,description_naver,salesPoint,mallType
선택 설계자들 - 어떻게 함정을 피하고 탁월한 결정을 내릴 것인가,"올리비에 시보니 (지은이), 안종희 (옮긴이)",3103,국내도서>경제경영>기업 경영>경영 일반,9791191056624,"올리비에 시보니가 맥킨지 경영 컨설턴트를 시작으로 30년간 연구하고 가르쳐온 경영전략, 의사결정, 문제해결에 관한 내용을 담은 “비즈니스 의사결정 분야의 결정판”으로 평가받는다. 2019년 맨파워재단으로부터 최우수 경영서상을 수상하기도 한 이 책은 리더와 조직을 치명적인 함정에 빠지게 한 9가지 편향을 선별하고, 이를 극복하게 하는 40가지 실무 기법을 제시한다.","“중대한 결정을 내리기 전, 반드시 이 책을 읽어라!”
맥킨지 최고의 전략적 의사결정 권위자가 
30년 연구 끝에 밝혀낸 최강의 의사결정 프로세스 

대니엘 카너먼, 애덤 그랜트, 앤젤라 더크워스 등 
전 세계 석학과 명사들의 끝없는 찬사!

애플스토어의 성공 신화를 쓴 론 존슨의 전략은 왜 JC페니에서 무참히 실패했을까?(모방의 함정)
스내플을 인수한 퀘이커오츠는 왜 14억 달러나 손해 보고 스내플을 재매각해야 했을까?(직관의 함정)
블록버스터는 추가 자금이 절실했던 넷플릭스의 인수 제안을 왜 단번에 무시했을까?(자기과신의 함정) 
GM은 총 200억 달러를 손해 보면서도 왜 27년 동안 새턴 사업부를 철수하지 못했을까?(관성의 함정) 

전략적 의사결정 분야의 권위자인 올리비에 시보니는 기업의 리더와 조직이 이와 같은 끔찍한 실수를 저지르는 데는 뚜렷한 공통점이 있다고 주장한다. 기업의 리더와 조직이 중대한 의사결정 과정에서 한결같이 비합리적인 편향에 지배받는다는 것이다. 앞서 리처드 탈러와 캐스 선스타인은《넛지》를 통해 상대방의 무의식적 편향을 이용해 최선의 행동을 이끌어내는 방법을 제시했다. 하지만 다른 사람의 편향을 이용하는 것과 자신의 편향을 극복하는 것은 별개의 문제다. 그렇다면 비즈니스 의사결정에서 발생하는 편향은 어떻게 극복해야 하는가. 

《선택 설계자들》은 올리비에 시보니가 맥킨지 경영 컨설턴트를 시작으로 30년간 연구하고 가르쳐온 경영전략, 의사결정, 문제해결에 관한 내용을 담은 “비즈니스 의사결정 분야의 결정판”으로 평가받는다. 2019년 맨파워재단으로부터 최우수 경영서상을 수상하기도 한 이 책은 리더와 조직을 치명적인 함정에 빠지게 한 9가지 편향을 선별하고, 이를 극복하게 하는 40가지 실무 기법을 제시한다. 중대한 결정 앞에서 자신의 편향에 대해 ‘무언가’를 해야 한다고 느끼고 있다면 이 책이 그 답을 알려줄 것이다.",1311,BOOK
반도체 투자 전쟁 - 글로벌 패권 경쟁이 가져올 거대한 기회,김영우 (지은이),3060,국내도서>경제경영>경제학/경제일반>경제사/경제전망>세계 경제사/경제전망,9791190977272,엄청난 변화는 엄청난 기회를 가져오기 마련이다. ‘한국에서 가장 신뢰할 수 있는 애널리스트’이자 2021년 여의도에서 가장 많이 회자된 리포트의 주인공이기도 한 SK증권의 김영우 이사는 『반도체 투자 전쟁』을 통해 지금 시점에서 반드시 주목해야 할 반도체 전쟁의 현재와 미래를 통찰했다.,"“반도체 슈퍼 사이클은 이제부터가 진짜 시작이다!” 2021년 여의도에서 가장 많이 회자된 리포트
김영우 연구원이 통찰한 반도체 전쟁의 현재와 미래

세계 반도체 공급망을 재편하기 위한 미국과 중국 간의 기술 패권 경쟁이 갈수록 뜨거워지는 양상이다. 중국은 2030년까지 인공지능 선도국가가 되겠다는 야심찬 계획을 발표했고, 미국 역시 전면전을 선언하며 주도권 사수에 나섰다. 세계 패권을 지키려는 미국과 패권에 도전하는 중국의 각축전은 국내 반도체 산업에도 적잖은 파장을 예고하고 있다.
엄청난 변화는 엄청난 기회를 가져오기 마련이다. ‘한국에서 가장 신뢰할 수 있는 애널리스트’이자 2021년 여의도에서 가장 많이 회자된 리포트의 주인공이기도 한 SK증권의 김영우 이사는 『반도체 투자 전쟁』을 통해 지금 시점에서 반드시 주목해야 할 반도체 전쟁의 현재와 미래를 통찰했다. 이 책을 통해 더 깊이 있게 미국과 중국의 전략을 이해하고, 이 전쟁이 반도체 산업에 미치는 영향을 파악해본다면, 우리 정책의 방향성은 물론 투자자들에게 찾아온 커다란 기회가 무엇인지도 분명하게 보일 것이다.",880,BOOK
2021 해커스 경찰 형사소송법 갓대환 진도별 문제풀이 500제 (경찰공무원) - 2021 경찰 2차 시험 대비 / 일반경찰.경찰승진.경찰간부.국가직 9급.법원직 / 합격예측 모의고사,김대환 (지은이),140203,국내도서>수험서/자격증>공무원 수험서>경찰공무원(승진)>형사소송법,9791166625046,"2021년 경찰 2차 시험 합격을 목표로 하는 학생들이 문제풀이를 통해 개정법령과 최신판례를 한 권으로 할 수 있도록 구성한 문제집이다. 500문제를 통하여 이론을 확실하게 익힐 수 있도록 하였으며, 문제와 정답이 있는 구성으로 빠르게 문제풀이가 가능하도록 하였다.","『2021 해커스경찰 갓대환 형사소송법 진도별 문제풀이 500제』는 2021년 경찰 2차 시험 합격을 목표로 하는 학생들이 문제풀이를 통해 개정법령과 최신판례를 한 권으로 할 수 있도록 구성한 문제집이다. 500문제를 통하여 이론을 확실하게 익힐 수 있도록 하였으며, 문제와 정답이 있는 구성으로 빠르게 문제풀이가 가능하도록 하였다. 

해커스경찰 사이트(police.Hackers.com)에서 제공되는 경찰공무원 전문 강사진들의 동영상강의 및 1:1 학습문의를 통하여 현장강의를 듣는 것과 같은 학습효과를 얻을 수 있으며, 본 교재를 학습하면서 해커스경찰 사이트에서 제공하는 무료 학습자료를 이용할 수 있어 더욱 효과적으로 시험에 대비할 수 있다.",541,BOOK
그녀도 여친 1,히로유키 (지은이),3742,국내도서>만화>순정만화>레이디스 코믹,9791136275851,,"진심으로 그녀와 마주했더니 나에게 애인이 두 명이 생겼다?!
스스로에게 절대로 거짓말을 하지 않는 네오 스탠더드 러브코미디!!

2021년 7월 애니메이션 방영 화제작!!

자신의 마음에 정직한 고등학생 나오야에게는 사키라는 귀여운 여자친구가 있었다. 그렇게 행복에 빠져 있던 나오야에게 갑작스레 나타난 미소녀 나기사가 고백을 하고, 나기사의 고백을 들은 나오야는 나기사에게 호감을 가지게 되어 의외의 제안을 하게 되는데…?!

둘 다 귀여워서 고를 수 없으니 고르지 않겠습니다!!
이것이 새로운 시대의 러브코미디♬♥",651,BOOK
사물의 뒷모습,안규철 (지은이),51376,국내도서>에세이>사진/그림 에세이,9791190885669,"조각가, 예술가라는 장르를 뛰어넘어 사물과 형상, 나아가 자신의 삶의 태도와 사유를 소박하고 순수하게 표현한 안규철의 에세이집이다. 첫 번째 책으로 2013년 출간된 &lt;아홉 마리 금붕어와 먼 곳의 물&gt;의 후속작인 &lt;사물의 뒷모습&gt;은 2014년 1월호부터 연재한 글과 그림 67편을 엮은 것이다.","사물의 뒤편에는 짐작보다 
훨씬 더 깊고 넓은 세계가 있다

『사물의 뒷모습』이 《현대문학》에서 출간되었다. 조각가, 예술가라는 장르를 뛰어넘어 사물과 형상, 나아가 자신의 삶의 태도와 사유를 소박하고 순수하게 표현한 안규철의 에세이집이다. 그는 ‘내 이야기로 그린 그림’이란 제목으로 월간 《현대문학》에서 2010년부터 11년 간 연재해오고 있다. 그 첫 번째 책으로 2013년 출간된 『아홉 마리 금붕어와 먼 곳의 물』의 후속작인  『사물의 뒷모습』은 2014년 1월호부터 연재한 글과 그림 67편을 엮은 것이다.

  사물에 대한 사유를 담은 ‘식물의 시간’, 말과 언어에 관한 생각을 묶은 ‘스무 개의 단어’, 미술과 글쓰기라는 일에 대한 방식의 모색 등을 모은 ‘예술가들에게 은혜를’, 삶의 체험이 담긴 에피소드로 인생을 들여다본 ‘마당 있는 집’까지 총 네 개 장으로 구성된다. 이번 책은 필자가 생의 보너스처럼 얻은 시간과 사유로 이끌어낸 공간의 여유로움 속에서 잠시 멈춰 서 새롭게 발견하게 된 세계를 모든 이에게 깊은 울림으로 보여준다.

 전작 『아홉 마리 금붕어와 먼 곳의 물』이 예술과 예술가적 삶에 깊이 있는 사색을 담았다면, 『사물의 뒷모습』은 오늘을 살아가는 평범한 사람으로서의 이야기 쪽으로 무게가 실려 있다. 특히 제목 속 ‘뒷모습’은 중년을 지나는 시점에서 이제까지 걸어온 길을 되돌아보는 자신의 뒷모습과, 사물 혹은 현상에서 보이는 것 이면의 뒷모습을 들여다본다는 두 가지 의미가 담겨 있다. 그가 서문에서 밝혔듯 “무심히 지나쳐왔던 풀과 벌레와 나무들을 만나고, 우리가 미처 깨닫지 못했던 사물의 뒷모습”을 보려는 노력이 따뜻한 시선과 만나 또 다른 세상을 펼쳐 보인다.

 「겉과 속」에서 그는 사물의 속이 궁금하지만 “힘들여 기계를 뜯어봐도 암호처럼 복잡한 회로판 앞에서 우리는 속수무책이다”. 그리고 “이런 관계가 우리 삶 전체를 지배한다(48쪽)”며 사물을 인식하는 관점을 인간세계로 넓힌다. 「직각의 문제」에서는 “직각을 못 맞추는 목수 때문에 낭패를 본 이야기”를 통해, 일에 결벽성을 가지지 못한 세태를 탄식하면서도 이제는 “소심한 원칙주의자” 같은 모습을 버리고 그런 식으로 인생을 다 허비할 수 없다며 그가 고수해온 삶의 방식에 대한 미련을 버리기도 한다. 
 「머그컵」에서는 한평생 예술가로 살아온, 그 삶이 고독하고 쉽지 않다는 것을 진솔하게 고백한다. 나아가 오직 인간만이 순응하지 못하는 자연의 법칙에 대한 비유들은 우리가 되새겨볼 만하다. “언제 끝날지 모르는, 그러나 언젠가 반드시 끝나게 되어 있는 실타래를 가지고 나는 결국 미완성으로 끝날 이 일을 매 순간 계속할 뿐(174쪽)”이라는 「씨줄과 날줄」의 고백은 영원히 나이 들지 않는 예술가 정신과 죽는 순간까지 자신이 사랑하는 일에 모든 것을 바치려는 필자의 지극함과 그 애절함을 엿볼 수 있게 한다.

“이 책은 그 이야기가 주역이 되는 또 다른 형식의 작품이다. 그저 짐작만으로 도달하려 했던 한 작가의 삶과 예술에 대한 열망과 머뭇거림, 희망과 탄식을 공유하면서, 우리의 짐작보다 훨씬 더 깊고 넓은 사유의 세계를 발견한다.” 
_안소연(아뜰리에 에르메스 아티스틱 디렉터)",5525,BOOK
해커스 토익 왕기초 RC Reading (리딩) - 최신기출경향 반영ㅣ토익 초보 토린이를 위한 토익 첫걸음,해커스어학연구소 (지은이),49854,국내도서>외국어>토익>Reading,9788965423300,영어 문법 및 구문 독해의 기본 개념이 정리된 '기본기 코너'와 '기초부터 차근차근' 코너를 통해 토익 리딩의 기초를 탄탄하게 다질 수 있다. 학습한 문법 지식과 구문 독해 방법을 바탕으로 직접 문제를 풀어볼 수 있는 지문 유형을 수록하였다.,"토린이를 위한 토익 첫걸음
해커스 토익 왕기초 READING

1. 기초부터 탄탄하게 토익 리딩 4주 완성!
2. 실제 토익 문제를 풀 수 있도록 돕는 풍부한 문제 제공 
3. 지문 끊어 읽기와 상세한 해설로 모든 지문 및 문제 꼼꼼하게 학습 가능
4. 보충 학습을 돕는 ‘문법 용어 인덱스 및 불규칙 변화 동사’ 수록",22387,BOOK
"건방이의 초강력 수련기 3 - 심해의 괴물, 건방이 시즌2","천효정 (지은이), 이정태 (그림)",48874,국내도서>어린이>동화/명작/고전>국내창작동화,9788949124445,시즌1에서 시즌2로 이어지는 내내 실력과 내면의 성장을 거듭해 온 건방이와 친구들은 이번에도 엄청난 ‘내공의 성장’을 선보인다. 대체 무슨 일이 일어나기에? 놀랍도록 업그레이드되는 이들의 능력은 『건방이의 초강력 수련기 3. 심해의 괴물』에서 직접 확인할 수 있다.,"‘건방이 시즌2’ 세 번째 이야기!
머니맨 어벤저스의 첫 원정 미션,
남해의 섬을 둘러싼 기이한 사건의 비밀을 밝혀라!

제2회 스토리킹 수상작 「건방이의 건방진 수련기」에 이어 독자들의 변함없는지지 가운데 전개 중인 ‘건방이 시즌2’ 「건방이의 초강력 수련기」 세 번째 이야기가 비룡소에서 출간됐다. ‘귀면을 쓴 자들’과의 대결이 계속되는 가운데, ‘포악’과 ‘탐욕’에 이어 이번에 나타날 적은 무엇을 무기로 머니맨들을 위협할지, 머니맨 어벤저스는 어떤 작전으로 독자들에게 통쾌함을 안겨 줄지 기대해 본다. 여름의 문턱, 시원하고 푸른 바다를 배경으로 펼쳐지는 모험을 즐기며, 답답하고 찌뿌둥한 기분을 조금은 떨쳐 낼 수 있는 시간을 가져 볼 수 있을 것이다.",2474,BOOK
현자의 제자를 자칭하는 현자 14 - S Novel+,"류센 히로츠구 (지은이), 후지 초코 (그림), 정대식 (옮긴이)",89167,국내도서>소설/시/희곡>라이트 노벨>S 노벨,9791166116063,"아홉 현자의 일원인 상극의 아르테시아와 성공적으로 재회하여 순조로운 아홉 현자 탐색 상황에 기분이 좋아진 미라는, 일단 루나틱레이크로 돌아갔다가 우연히 학원에서 만난 덤블프를 숭배하는 소녀, 에밀리아에게 가르침을 주게 된다.","“호오, 이거 원…… 범인은 목숨이 필요 없는 모양이로군.”

아홉 현자의 일원인 상극의 아르테시아와 성공적으로 재회하여 순조로운 아홉 현자 탐색 상황에 기분이 좋아진 미라는, 일단 루나틱레이크로 돌아갔다가 우연히 학원에서 만난 덤블프를 숭배하는 소녀, 에밀리아에게 가르침을 주게 된다. 그러던 어느 날, 학원에 장식된 아홉 현자의 초상화에 낙서가 되어 있는 것을 발견하고 분노한 미라는 학생으로 변장하고 범인 수사에 나서는데──.",764,BOOK
크래프톤 웨이 - 배틀그라운드 신화를 만든 10년의 도전,이기문 (지은이),853,국내도서>경제경영>기업/경영자 스토리>국내 기업/경영자,9788934986836,2007년 창업에서부터 배틀그라운드를 출시하기까지 10년간 크래프톤이 어떻게 실패를 극복하며 ‘게임 제작의 명가’로 성장해왔는지 보여주는 크래프톤의 자서전이다. 수많은 게임이 명멸하는 전장에서 백 번의 패배 끝에 전 세계 10억 유저가 열광하는 ‘배틀그라운드’로 최고가 되기까지 10년의 스토리를 사내 이메일과 내부자 인터뷰로 생생하게 담아낸 크래프톤 방식이 마침내 공개된다.,"“우리는 빠른 추격자가 아닌 최초의 선도자가 되기를 열망했다”

창업자들의 첫 만남부터 게임 제작의 명가가 되기까지
크래프톤은 어떻게 실패를 극복하고 무엇을 만들었나
크래프톤이 직접 밝힌 크래프톤 방식의 비밀

2017년 출시한 서바이벌 슈팅 게임 ‘플레이어언노운스 배틀그라운드’는 한국 게임의 역사를 새로 쓴 대작으로, 전 세계 PC용 타이틀 7천만 장 이상 판매, 전 세계 모바일 누적 가입자 수 10억 명을 돌파하며 연일 기록을 갈아치우고 있다. 배틀그라운드의 세계적인 흥행을 바탕으로 국내 게임업계에서 변두리에 머물던 크래프톤은 글로벌 회사로 거듭났다.
이 책은 2007년 창업에서부터 배틀그라운드를 출시하기까지 10년간 크래프톤이 어떻게 실패를 극복하며 ‘게임 제작의 명가’로 성장해왔는지 보여주는 크래프톤의 자서전이다. 
수많은 게임이 명멸하는 전장에서 백 번의 패배 끝에 전 세계 10억 유저가 열광하는 ‘배틀그라운드’로 최고가 되기까지 10년의 스토리를 사내 이메일과 내부자 인터뷰로 생생하게 담아낸 크래프톤 방식이 마침내 공개된다.",3101,BOOK
당신이 그린 우주를 보았다 - 이토록 풍부한 여성영화의 세계,손희정 (지은이),51042,국내도서>예술/대중문화>영화/드라마>영화이야기,9788960906808,"문화평론가 손희정이 2019~2020년 장편 극영화를 선보인 여성감독 13인(김도영, 윤가은, 김보라, 장유정, 임선애, 안주영, 유은정, 박지완, 김초희, 한가람, 차성덕, 윤단비, 이경미 감독)과 나눈 인터뷰를 엮어 여성영화 유니버스를 펼쳐 보인다.","#Scene 1 
“나는 나에 대해서 오래 연구했다. 그 과정을 통해 깨달았다. 
스스로를 충분히 이해하는 사람이야말로 인간을 이해할 수 있다는 걸. 
나는 내 고통에 공감하고 그에 마음을 기울였지만, 
그것만이 특별하다고 여기지 않는다. 
우리 모두는 연결되어 있다.”_김보라(〈벌새〉 감독)",686,BOOK
신의 탑 7~8권 + 북케이스 세트,SIU (지은이),7443,국내도서>만화>인터넷 연재 만화,9791190153959,"최종 시험장에 황소가 나타났다. 정체불명의 생명체 황소는 난폭한 성격으로 몰이꾼인 망돌고래부터 심지어 사람까지 잡아먹는 엄청난 식성을 가졌다. 엄청난 난항이 예상되는 가운데, 자하드의 공주 엔도르시와 아낙이 나섰다.","“미끼를 물었군.”
선별인원을 노리는 의문의 인물?

-7권-
최종 시험장에 황소가 나타났다. 정체불명의 생명체 황소는 난폭한 성격으로 몰이꾼인 망돌고래부터 심지어 사람까지 잡아먹는 엄청난 식성을 가졌다. 엄청난 난항이 예상되는 가운데, 자하드의 공주 엔도르시와 아낙이 나섰다. 큰 덩치, 민첩한 속도, 두꺼운 가죽을 가진 황소는 확실히 강한 상대이기 때문에 고전하리라 생각했던 것과 달리 엔도르시는 가뿐하게 황소를 제압한다. 최종 시험에 큰 걸림돌이었던 황소가 이렇게 쉽게 당한다고? 엔도르시의 힘에 감탄하던 것도 잠시, 모두가 방심한 틈을 타 황소가 도망을 쳤다. 캄캄한 어둠 속으로 사라진 황소를 뒤쫓아 간 엔도르시와 아낙. 하지만 이때까진 그 누구도 알지 못했다. 이 모든 것이 계략이었음을...!

-8권-
황소의 공격을 받은 밤과 라헬! 황소를 막지 못하면 시험 실패는 물론 밤과 라헬의 목숨도 위험해진다. 신수를 모아 황소의 움직임을 멈췄지만 아직 두 개의 방을 다루기엔 역부족인 밤은 멈춰놓은 황소를 공격할 수가 없다. 설상가상으로 부상까지 입은 밤. 라헬을 위해서도, 함께 하는 동료들을 위해서라도 이번 시험은 꼭 통과해야 한다. 이 게임만 끝나면 라헬과 함께 탑을 오를 수 있다. 밤은 마지막 한 방을 위해 모든 힘을 끌어 모으는데...! 별을 보고 싶어 한 소녀와 그 소녀를 바라는 한 소년의 이야기. 탑의 정상을 향한 대모험의 시작. 밤과 라헬은 무사히 시험의 층을 통과할 수 있을까?",322,BOOK
김락희의 인체 드로잉,"김락희 (지은이), 윤관현 (감수)",50987,국내도서>예술/대중문화>미술>미술 실기,9788931588507,국내에서 유튜브 드로잉 채널을 운영하면서 드로잉 강의를 하고 있으며 미 마블 사의 애니메이션 캐릭터 작업도 하고 있는 김락희 작가가 드로잉 입문자를 위한 인체 해부학 입문서를 출간하였다.,"美 마블 社에서 활약 중인 김락희 작가의 인체 드로잉 핵심 강의! 
도형화부터 해부학, 동세까지 단계별로 배운다!

국내에서 유튜브 드로잉 채널을 운영하면서 드로잉 강의를 하고 있으며 미 마블 사의 애니메이션 캐릭터 작업도 하고 있는 김락희 작가가 드로잉 입문자를 위한 인체 해부학 입문서를 출간하였다. 드로잉을 공부할 때 인체 해부학을 모르고서는 그림의 기본을 다질 수 없으므로 이 책은 인체의 도형화부터 시작해 해부학을 공부하고 동세(動勢)를 단계별로 강의한다. 특히 인체 비례와 균형까지 한눈에 들어와야 한다는 저자의 고집으로 A4 사이즈 가로 크기로 과감하게 판형을 결정하여 보기 드문 해부학 드로잉 입문서를 탄생시켰다.",35738,BOOK
2021 ACL 김중근 형법 60일 예상적중문제선 : 2차 대비,김중근 (지은이),34623,국내도서>수험서/자격증>공무원 수험서>7/9급 공무원>법학>형법,9791165231996,"매 시험 직전마다 새롭게 제작되어 출간되는 도서이다. 과목별 특성에 맞게 진도별 문제풀이, 반범위 문제풀이, 모의고사 등 다양한 형태로 구성하였다. 전범위를 회독하면서 개개인의 취약점 위주로 학습을 진행, 짧은 시간에 회독수를 극대화할 수 있다.","해당 도서는 21년 2차 대비 60일작전 (21년 6(7)-8월) 주교재입니다.

1순환 진도별 문제, 2순환 반범위 문제로 구성
학습에 부족했던 부분을 파악하여 학습에 도움
시험 전 최종 마무리하는 도서로써, 21년 최신개정법 및 최신판례를 반영한 문제로 시험을 효과적으로 대비",314,BOOK
라라의 결혼 3,타메코우 (지은이),6130,국내도서>만화>순정만화>그 남자들의 사랑,9791134886974,"예정돼 있던 부호와 혼례를 치르기 직전, 쌍둥이 여동생 라라는 좋아하는 남자와 마을을 떠난다. 라무단은 쌍둥이 동생의 도주를 돕기 위해 그녀 대신 신부로 변장하고 결혼한다. 결혼 첫날 밤, 적당한 때를 봐서 부호의 집을 빠져나오려 하지만….","인기 작가 타메코우의 신작이 드디어 국내에 발행된다.
특히 이번《라라의 결혼》은 일본에서 발매되자마자 큰 반향을 일으키며 중쇄를 거듭하고 있고, 현재 드라마시디로도 제작되는 등 많은 인기를 얻고 있다.
이미 국내 BL 팬들 사이에서도 입소문이 퍼지고 발행 문의가 이어지는 만큼, 많은 사랑을 얻을 것으로 확신한다.",720,BOOK
