title,author,genre_id,genre,ISBN,description_aladin,description_naver,salesPoint,mallType
"괴롭히지 말아요, 나가토로 양 6 - S코믹스","나나시 (지은이), 김현주 (옮긴이)",3742,국내도서>만화>순정만화>레이디스 코믹,9791165072308,"2019년 동안 사랑받은 최고의 S코믹스, 《괴롭히지 말아요, 나가토로 양》단행본 6권. 당신이 너무 좋으니까, 전력으로 괴롭힐게요!! 최강인 “사디스트 데레 소녀”가 나타나다!!","당신이 너무 좋으니까, 전력으로 괴롭힐게요!!
최강인 “사디스트 데레 소녀”가 나타나다!!

2019년 동안 사랑받은
최고의 S코믹스, 〈괴롭히지 말아요, 나가토로 양〉
단행본 6권 초스피드 한국정식판 발매!!

일본 현지 누적 판매 부수 100만부 돌파!!",988,BOOK
철학은 어떻게 삶의 무기가 되는가 - 불확실한 삶을 돌파하는 50가지 생각 도구,"야마구치 슈 (지은이), 김윤경 (옮긴이)",51440,국내도서>인문학>철학 일반>교양 철학,9791130620459,비즈니스 현장에서 유용하게 사용하는 50가지 철학·사상을 담은 『철학은 어떻게 삶의 무기가 되는가』는 철학의 쓸모를 새롭게 조명하는 세상에서 가장 실용적인 철학 사용 설명서다.,"철학이 현실 세계와 동떨어진 학문이라는 말을 강하게 부정하는 저자는 사람들이 철학을 쓸모없다고 여기는 이유가 철학과 비즈니스를 연결시켜서 생각하는 법을 모르기 때문이라고 진단한다. 오히려 그는 본질을 꿰뚫고 최적의 솔루션을 찾아내는 철학적 사고법이야말로 현대인들에게 가장 필요한 무기라고 말한다. 그가 비즈니스 현장에서 유용하게 사용하는 50가지 철학·사상을 담은 『철학은 어떻게 삶의 무기가 되는가』는 철학의 쓸모를 새롭게 조명하는 세상에서 가장 실용적인 철학 사용 설명서다.



일본에서 가장 주목받는 컨설턴트답게 저자는 난해하거나 고리타분한 이야기는 빼고, 바로 지금 우리 삶에서 벌어지는 문제와 그 해결책에 주목한다. 비즈니스 기회를 찾고자 할 때는 프레드리히 니체의 ‘르상티망’을 사용하고, 다른 사람과 대화하기가 힘들 때는 에드문트 후설의 ‘에포케’를 처방하는 등 일과 삶의 모든 과제를 철학으로 해결한다. 현실에 단단히 발을 붙이고 철학 개념으로 새로운 관점을 제시하는 이 책을 통해 독자들은 일상의 고민에서 비즈니스 전략까지 삶의 모든 부분에서 지적 전투력을 극대화하는 철학적 사고법을 얻을 수 있을 것이다.",20019,BOOK
교통경찰의 밤,"히가시노 게이고 (지은이), 양윤옥 (옮긴이)",51058,국내도서>소설/시/희곡>추리/미스터리소설>일본 추리/미스터리소설,9791136216182,‘교통경찰’이라는 소재를 중심에 두고 각 작품들이 반전 매력 가득한 엔딩을 맞는 『교통경찰의 밤』은 히가시노 게이고 필력의 진수를 엿볼 수 있는 단편집이다. 교통 법규 위반이라는 일상적인 범죄에 그만이 낼 수 있는 독특한 상상력을 녹여 내어 시대를 초월해 공감을 불러일으키는 시리즈로 탄생시켰다.,"사소한 교통사고가 일생을 뒤흔드는 재앙이 되다!

지금 읽어도 전혀 위화감이 들지 않을 정도로 참신한 소재와 경쾌한 문체로 쓴 히가시노 게이고의 초기 단편을 엮은 『교통경찰의 밤』. 교통경찰이라는 소재를 중심에 두고 각 작품들이 반전 매력 가득한 엔딩을 맞는 작품들로, 저자의 필력의 진수를 엿볼 수 있는 단편집이다. 작품 속에 녹아든 저자 특유의 치밀한 트릭은 왜 그가 독자들의 사랑을 받을 수밖에 없는지 고개를 끄덕이게 만든다.

시각장애인 소녀의 기적 같은 청각이 밝혀낸 교통사고의 전말과 오싹한 반전을 그린 《천사의 귀》, 양날의 칼 같은 교통 법규에 처절하게 저항하는 인간의 모습을 보여 주는 《중앙분리대》, 앞서가는 초보운전 차를 재미로 위협한 뒤차 운전자에게 매섭게 불어 닥친 후폭풍을 속 시원하게 전개하는 《위험한 초보운전》 등 교통 법규 위반이라는 일상적인 범죄에 저자만이 낼 수 있는 독특한 상상력을 녹여 내어 시대를 초월해 공감을 불러일으키는 시리즈를 만나볼 수 있다.",2653,BOOK
아홉 명의 완벽한 타인들,"리안 모리아티 (지은이), 김소정 (옮긴이)",51055,국내도서>소설/시/희곡>세계의 소설>기타 국가 소설,9788947545211,"《허즈번드 시크릿》, 《커져버린 사소한 거짓말》 리안 모리아티의 최신작. 아홉 명의 낯선 사람들이 최고급 힐링 프로그램이 진행되고 있는, 도시에서 멀리 떨어진 건강 휴양지에 모인다. 그런데, 이 낯선 이방인들을 특별한 사명감으로 지켜보고 있는 한 사람이 있다.","▶ 바로드림, 영업점 구매시 일반판 도서가 제공될 수 있습니다.

같은 지붕 아래 모인 낯선 사람들이 보내야 할 돌이킬 수 없는 열흘!

《허즈번드 시크릿》, 《커져버린 사소한 거짓말》의 저자 리안 모리아티가 매력적인 다양한 캐릭터와 제한된 배경, 쫄깃한 긴장감, 적절하게 숨겨진 복선과 반전을 통해 사랑과 상실, 아픔, 좌절로 고군분투해야 하는 인생이라는 미로 속으로 능숙하게 독자들을 데리고 가는 『아홉 명의 완벽한 타인들』. 아홉 명의 낯선 사람들이 어쩌면 서로에게 힘이 되는 완벽한 타인으로 거듭날 수 있다는, 다소 역설적이지만 늘 외로움을 느끼며 오늘을 살아가는 우리에게 매우 필요한 희망을 선물하는 주제가 담긴 소설이다.

몸과 마음을 치유하기로 이름난 최고급 건강휴양지 ‘평온의 집’. 이곳으로 각기 다른 사연을 지닌 아홉 명의 사람들이 모여든다. 일상을 짓누르던 스트레스와 마음의 짐을 내려놓고 명상과 수련을 통해 이전과는 전혀 다른 사람으로 거듭나기 위해 기꺼이 차도, 휴대폰도 허용되지 않는 열흘간의 삶을 선택한 것이다. 이제부터 외부 세계와 접촉하거나 일탈할 수 있는 방법은 아무것도 없다. 그저 여기서 시키는 대로 자기 자신에게 집중하고 서로를 알아가기만 하면 된다. 

그들 중에는 한때 잘나가는 베스트셀러 작가로 유명세를 떨쳤지만 지금은 한물 간 중년의 로맨스 소설가 프랜시스 웰티가 있다. 몸과 마음 모두 지친 상태로 ‘지푸라기라도 잡는 심정’으로 이곳을 찾은 프랜시스. 그녀는 그 즉시 여기에 모인 낯선 손님들에게 흥미를 느끼지만, 겉보기엔 그 누구도 이런 휴양지가 필요해보이지 않는다. 과연 저들은 대체 왜 이곳을 찾아온 걸까? 

그리고 이 낯선 이방인들을 특별한 사명감으로 지켜보고 있는 한 사람이 있다. 베일에 가려진 채 묘한 카리스마를 풍기는 평온의 집 원장, 마샤. 매혹적인 겉모습 뒤로 어둠을 감추고 있는 평온의 집의 정체는 과연 무엇인가? 프랜시스는 모든 의심을 떨치고 평온의 집이 제공하는 프로그램에 몰두해야 할까, 아니면 가능할 때 하루라도 빨리 도망쳐야 할까? 열흘 후, 과연 아홉 손님들은 자신들의 바람대로 전혀 다른 사람이 되어 이 집을 나갈 수 있을까?",3599,BOOK
"밀레니얼 이코노미 - 밀레니얼 세대의 한국 경제, 무엇이 달라지고 어떻게 돌파할 것인가","홍춘욱, 박종훈 (지은이)",3058,국내도서>경제경영>경제학/경제일반>경제사/경제전망>한국 경제사/경제전망,9791189995393,"국내 대표적인 두 이코노미스트인 홍춘욱 박사와 박종훈 기자가 신간 《밀레니얼 이코노미》를 통해 ‘세대교체 지연’의 구조적 원인을 찾는 동시에 IT, 제조, 유통, 금융, 교육 등 전 산업 분야의 새로운 흐름을 예측하며, 밀레니얼 세대가 어떤 소비와 투자 취향을 키워가고 있는지 대담을 펼쳤다.","밀레니얼 세대를 위한 종합적인 경제 안내서!

국내 대표적인 두 이코노미스트 홍춘욱 박사와 KBS 보도본부 경제부장 박종훈 기자가 세대교체 지연의 구조적 원인을 찾는 동시에 IT, 제조, 유통, 금융, 교육 등 전 산업 분야의 새로운 흐름을 예측하며, 밀레니얼 세대가 어떤 소비와 투자 취향을 키워가고 있는지에 대해 나눈 대담을 담은 『밀레니얼 이코노미』.

두 저자가 현재 한국 경제 상황에 대해 내놓은 진단은 ‘지연된 밀레니얼 이코노미(delayed millennial economy)’라는 점이다. 이전 세대에서 해결하지 못한 채 끌고 온 여러 구조적 문제들 때문에 밀레니얼 세대가 주체적인 역할을 담당하지 못하는, 세대교체를 이루지 못하고 있는 경제 상태라는 의미다. 2020년 이후의 한국 사회와 밀레니얼 세대는 이전 세대가 남겨둔 경제구조, 산업, 노동, 소비, 투자의 여파들을 고스란히 맞닥뜨리게 된다. 

그럼에도 불구하고 전 세계적으로 2020년을 기점으로 밀레니얼 세대는 경제의 주도권을 쥐고 이전 세대와는 다른 소비, 투자, 일자리, 산업의 변화를 이끌고 있다고 이야기하면서 국내외 다양한 데이터들을 근거로 한 앞으로의 부동산 예측, 공유경제와 스타트업 열풍, 달러에서 비트코인까지의 대안 투자처, 정년연장 논의와 국민연금 고갈 이슈에 이르는 다채로운 주제들에 대한 설전을 담아 경제 전 분야에서 활약하게 낼 밀레니얼 세대는 물론, 이들의 부모세대인 50~60대 독자들에게도 든든한 경제 나침반이 되어준다.",2128,BOOK
귀멸의 칼날 12,고토게 코요하루 (지은이),4133,국내도서>만화>본격장르만화>판타지>액션 판타지,9791134829827,"때는 다이쇼 시대. 숯을 파는 마음씨 착한 소년 탄지로의 일상은 가족들이 도깨비에게 몰살당하면서 돌변한다. 유일하게 살아남았으나 도깨비로 변모된 누이동생 네즈코를 원래대로 돌려놓기 위해, 가족을 죽인 도깨비를 응징하기 위해 탄지로와 네즈코는 길을 떠난다.","113년 만에 상현 도깨비가 죽자 분개한 무잔은 나머지 상현 도깨비들에게 또 다른 명령을 내린다! 한편, 규타로와의 싸움 도중 칼날이 나간 탄지로에게 하가네즈카는 대 격노. 새로운 칼을 찾아 탄지로는 하가네즈카가 있는 도공(刀工) 마을을 찾아가는데…?!",7553,BOOK
겨울왕국 2 OST 피아노 연주곡집 Easy Ver. - 체르니 100~30 초반 난이도,"조희순, 삼호뮤직 콘텐츠기획개발부 (엮은이)",51195,국내도서>예술/대중문화>음악>악보/작곡>피아노 및 건반악기 악보,9788932637617,"5년 만에 돌아온 영화 [겨울왕국 2] OST의 전곡을 체르니 100~30 초반 난이도로 쉽게 편곡한 피아노 연주곡집이다. 원곡의 원어 노랫말과 영화의 장면을 담은 스틸 컷, 포토 엽서 8종과 네임 스티커와 다이어리 꾸미기 스티커가 있어 소장 가치가 충분하다.","엘사, 안나 is coming back! 겨울왕국2의 감동을 피아노로 또 다시 느껴 본다!

5년 만에 돌아온 영화 「겨울왕국2」 OST의 전곡을 체르니 100~30 초반 난이도로 쉽게 편곡한 피아노 연주곡집이다. 원곡의 원어 노랫말과 영화의 장면을 담은 스틸 컷, 포토 엽서 8종과 네임 스티커와 다이어리 꾸미기 스티커가 있어 소장 가치가 충분하다. 영화의 감동을 이제 피아노 연주로 다시 느껴 보자.",1554,BOOK
디즈니 겨울왕국 2 무비동화 박스 세트 - 전2권,"디즈니 동화 아트팀 (그림), 수잔 프랜시스 (각색)",35111,국내도서>유아>그림책>유아 캐릭터 그림책,9788926211830,"끊임없이 들려오는 비밀의 목소리를 따라 엘사와 안나, 올라프 그리고 크리스토프와 스벤은 북쪽으로 여행을 떠나게 된다. 과연 일행은 위험에 빠진 아렌델을 구하고 다시 행복한 시간을 함께 보낼 수 있을까?",,851,BOOK
2019 제10회 젊은작가상 수상작품집,"박상영, 김희선, 백수린, 이주란, 정영수, 김봉곤, 이미상 (지은이)",50993,국내도서>소설/시/희곡>한국소설>2000년대 이후 한국소설,9788954655811,등단 10년 이하의 젊은 작가들이 한 해 동안 발표한 중단편소설 가운데 가장 뛰어난 일곱 편을 선정해 수여하는 젊은작가상. 2019년 제10회 수상 작가는 박상영 김희선 백수린 이주란 정영수 김봉곤 이미상이다.,"한국소설의 내일을 담당할 젊은 작가들의 젊은 소설!

한 해 동안 발표한 중단편소설 중 빛나는 성취를 보여준 작품에 수여하는 문학동네 젊은작가상. 2010년에 제정된 ‘젊은작가상’은 열정과 패기로 충만한 한국 문단의 젊은 작가들을 대상으로, 등단 십 년 이내의 작가들로 제한하여 그동안 집중적으로 조명되지 않은 개성에 주목한다. 매해 일곱 편의 수상작과 젊은 평론가의 해설을 엮어 출간해온 젊은작가상 수상작품집은 한국문학의 정체를 한순간도 용납하지 않고 갱신을 반복하는 젊은 작가들의 노력의 결실이기도 하다. 

제10회 젊은작가상 대상 수상작은 2016년 문학동네신인상에 단편소설 《패리스 힐튼을 찾습니다》가 당선되어 등단한 후 2018년 젊은작가상을 수상한 작가 박상영의 《우럭 한 점 우주의 맛》으로 선정되었다. 아들의 정체성을 부정하는 엄마와 자신의 정체성을 부인하는 애인 사이에서 갈등하면서도 그들을 떠나지 못하는 ‘나’를 통해 사랑의 어쩔 수 없음과 관습화된 세계에 내재한 속물성 등을 웃음과 눈물, 단맛과 짠맛을 모두 동원해 속도감 있게 그려내며 10주년을 맞아 더 뜻 깊은 대상 수상의 영광을 안았다.",12437,BOOK
"설민석의 한국사 대모험 11 - 고구려 편 : 부마 온달, 태학에 들어가다!","설민석, 스토리박스 (지은이), 정현희 (그림), 태건 역사 연구소 (감수)",48904,국내도서>어린이>초등 한국사,9791188874385,"재미있는 스토리와 다양한 한국사 이야기를 통해 어린이들에게 지식과 감동, 재미를 심어주는 &lt;설민석의 한국사 대모험&gt; 시리즈. 11권에서는 우리의 주인공 온달이 모두가 인정하는 부마로 거듭나기 위해 고구려에서의 생활을 시작하는 모습을 그리고 있다.","우리 아이의 ‘지’와 ‘덕’을 책임질 첫 역사책!

『설민석의 한국사 대모험』은 설민석 선생님과 태건 역사 연구소가 철저하게 고증하여 정확한 역사 지식을 어린이들에게 쉽고, 재미있게 알려주는 책입니다. 어린이들이 일상에서 고민할 수 있는 문제들을 역사 속 인물을 통해 같이 생각하고 해결해 볼 수 있도록 구성되어 있습니다. 우리가 매일 쓰고 있는 한글을 만든 세종대왕, 수원화성에 담긴 정조의 마음, 조선왕조실록의 의미 등 한국의 문화유산에 대해 만나게 될 것입니다.

태학을 1등으로 졸업하겠노라 큰소리쳤지만, 시작부터 온달의 앞날이 밝아 보이지는 않습니다. 고위 귀족 가문의 자제들이자 실력 또한 뛰어난 고진표, 연개문, 대조연, 이 태학 3인방은 평민 출신인 온달에게 사사건건 시비를 걸며 온달을 골탕 먹일 계획만 세웁니다. 무시무시하게 생긴 태학 학생 대표 문덕은 온달과 공칠에게 엄격하기만 합니다. 게다가 그동안 온달의 든든한 조력자였던 설쌤과 평강은 이제 적극적으로 온달을 돕거나 지켜주기가 어려워졌습니다. 고구려에 대해서는 아는 것도 거의 없고, 아직은 다른 태학생들에 비해 실력이 부족한 온달은 과연 태학을 무사히 졸업할 수 있을까요?",9713,BOOK
ETS 토익 정기시험 기출문제집 RC - 신토익 출제기관 최신기출 독점공개 / 해설집 무료 제공,ETS (엮은이),49854,국내도서>외국어>토익>Reading,9788917228854,실제 토익을 경험해보고 감각을 익히는 데에 적합한 토익 실전서. 토익 중급자 이상의 학습자 뿐만 아니라 초급자도 쉽게 문제를 이해할 수 있도록 해설을 간략하고 쉽게 구성하여 실전서에 대한 부담이 있는 학습자의 편의를 배려하였다.,"『ETS 토익 정기시험 기출문제집 RC 리딩』은 출제기관 ETS의 실제 토익 기출문제를 접할 수 있는 유일한 토익 교재로 토익 학습에 적합하고 효율적이다. 정기시험의 유형과 난이도를 직접 체험하여 실전 감각을 최대치로 끌어올릴 수 있으며, 정기시험과 동일한 성우 음성으로 실제 시험장과 같은 분위기에서 학습이 가능하다.",27375,BOOK
"50부터는 인생관을 바꿔야 산다 - 이제 자존심, 꿈, 사람은 버리고 오직 나를 위해서만!","사이토 다카시 (지은이), 황혜숙 (옮긴이)",70219,국내도서>자기계발>중년의 자기계발,9791190356039,50부터는 인생의 목적과 가치관을 오직 나 중심으로 재정립해야 한다. 다른 사람과 비교하며 남들에게 인정받으려고 애쓰던 방식에서 벗어나 오직 자신을 위한 삶을 살아야 한다. 이 책은 50대를 살아가는 사람이나 앞으로 50대를 준비하려는 사람들에게 실질적인 지침을 알려준다.,"50대부터는 완전히 다른 인생관을 가지고 그전과는 다른 삶을 살아야 한다!

갱년기 우울증이라고 부를 정도는 아니지만 왠지 모르게 마음이 울적하고, 사회에서도 한계에 부딪히고, 가정에서도 변화가 생기며, 인간관계도 이전과는 달라지는 등 많은 사람들이 인생의 전환기라고 느끼는 50세. 인생의 후반인 50세가 넘어서 찾아오는 위기들을 어떻게 극복해야 할까?

『50부터는 인생관을 바꿔야 산다』는 이제껏 추구해왔던 인생의 목적이나 가치의 기준이 흔들리면서 폭탄 터지듯 위기가 한꺼번에 찾아오는 50대를 준비하려는 사람들에게 실질적인 지침을 제공한다. 1장에서는 우리가 50세가 되었을 때 흔히 품게 되는 후회나 질투 같은 부정적인 감정과 마주하고, 2장에서는 저자 자신이 겪었던 어려움을 되돌아보면서, 그때 생긴 마음의 상처나 부정적인 감정에서 탈출하고자 어떤 노력을 기울여 왔는지 털어놓는다.

3장에서는 보통 50세라는 나이가 인생에서 어떤 위치를 차지하는지, 그때 어떤 위기를 맞이하게 되는지 살펴본다. 4장에서는 50세에 마주하게 된 위기를 극복하고 인생의 후반을 충실하게 보낼 방법을 이야기하고, 5장에서는 절대 피해갈 수 없는, 소중한 사람과 이별하는 슬픔을 어떻게 받아들여야 할지 그리고 나아가 점점 더 현실로 다가오기 시작한 죽음에 대한 공포를 어떻게 극복해야 할지 선조들이 남긴 교훈을 참고하여 살펴본다.",4509,BOOK
나를 아프게 하지 않는다 - 상처만 주는 가짜 자존감 나를 지키는 진짜 자존감,전미경 (지은이),51514,국내도서>인문학>심리학/정신분석학>교양 심리학,9791196533472,오늘날 자존감을 키워준다는 조언들이 많은데 왜 도돌이표처럼 내 자존감은 제자리에 있는지를 최신 심리학 이론과 풍부한 임상 경험을 바탕으로 알려준다.,"어떤 상황에서도 자기중심을 잃지 않는 진짜 자존감을 만들다!

우리는 어쩌다 자존감의 시대를 살게 되었을까? 원래 자존감이라는 게 이렇게 만들어지기 어려운 것이었나? 내 자존감은 왜 도돌이표처럼 제자리에 있을까? 『나를 아프게 하지 않는다』는 최신 심리학 이론과 풍부한 임상 경험을 바탕으로 한 나를 더 자유롭게 만들고, 나아가 다른 이들과 긍정적인 관계를 맺을 수 있는 능력을 키워주는 여섯 가지 레슨을 통해 어떤 상처에서 흔들리지 않는 진짜 자존감을 키우는 법을 알려준다.

내향적 성격으로 인해 오랫동안 자존감의 문제를 고민해왔으며, 특히 젊은 세대들의 마음의 문제를 주로 다뤄온 저자 전미경 원장은 어차피 내 인생은 이미 정해졌고, 내가 할 수 있는 일이 없고, 이렇게 타고난 걸 어떻게 하냐는 생각에서 벗어나 지금 서 있는 이 자리에서 아픈 과거를 뒤돌아보지 않고, 자기 힘으로 한발씩 나아갈 수 있도록 도와준다. 공허함을 존재감으로 채우기 위해서 어떻게 내가 생각하는 방식을 바꾸어야 하는지, 자기다움을 찾기 위해서는 어떤 능력을 키워야 하는지라는 관점에서 자존감의 문제를 새롭게 접근할 수 있도록 한다.",2419,BOOK
그리스 로마 신화 14 : 인간들의 무모한 소원,"박시연 (지은이), 최우빈 (그림), 김헌 (감수)",48910,국내도서>어린이>사회/역사/철학>신화/종교,9788950971496,"그리스 로마 신화의 이야기를 재미있는 만화로 풀어내고 신화 속 지식을 쉽게 구성한 책이다. 그리스 로마 신화는 서양의 문화를 이해하는 원천이고, 신과 영웅들의 다양한 모습을 통해 삶의 지혜를 배울 수 있는 인류 최고의 고전이다.","만화로 읽는 어린이 인문학 『그리스 로마 신화. 14: 인간들의 무모한 소원』은 그리스 로마 신화의 이야기를 재미있는 만화로 풀어내고 신화 속 지식을 쉽게 구성한 책입니다. 그리스 로마 신화는 서양의 문화를 이해하는 원천이고, 신과 영웅들의 다양한 모습을 통해 삶의 지혜를 배울 수 있는 인류 최고의 고전입니다. 또한 수천 년 동안 무한히 펼쳐진 상상력의 세계를 담고 있기도 합니다. 이처럼 중요한 고전이지만 신화를 읽는 어린이들은 복잡하고 어렵게 느껴져 읽기 쉽지 않았습니다. 〈만화로 읽는 어린이 인문학, 그리스 로마 신화〉는 신들의 왕 제우스를 중심으로 올림포스 십이 신들이 어떻게 이 세계를 이끌었는지를 시간의 흐름에 따라 재미난 이야기 형식으로 꾸몄습니다. 신화에 대한 쉽고 재미난 해석으로 어린이들이 신화에 친근감을 느끼고, 신화를 제대로 이해하는 데 큰 도움을 줍니다.",2051,BOOK
부자의 독서 - 그들은 무엇을 어떻게 읽는가,"김학렬(빠숑), 김로사, 김익수 (지은이)",70216,국내도서>자기계발>성공>성공학,9788901238753,"우리는 왜 지금 책을 읽어야 하는가. 부의 감각을 지닌 사람들은 수많은 책을 읽고 또 읽으며 통찰을 발견하고 깨달음을 얻는다. 투자의 첫걸음이자 무기가 되는 독서는, ‘경제적 자유’를 꿈꾸는 모든 이들에게 날카롭고 위대한 인사이트의 힘을 가져다줄 것이다. 『부자의 독서』는 그 가치투자의 여정을 함께할 수 있는 책이다.","부의 길로 떠나는 이들에게 전하는 지혜와 진리!

빌 게이츠, 일론 머스크, 마크 저커버그, 워런 버핏, 조지 소로스, 손정의…. 우리가 알고 있는 세계 최고의 부자들은 왜 모두 독서광일까? 『부자의 독서』는 팟캐스트 ‘다독다독’에서 2년간 200여 회 방송에서 다룬 100권의 책 가운데, 재테크 입문자들에게 가장 먼저 권하고 싶은 책들만 골라 정리하고 글을 덧댄 결과물이다. 방송에서 미처 말하지 못했던 생각, 그 책을 고르고 방송한 이유 그리고 책에 대해 깊이 있게 다뤘다. 

고전뿐 아니라 몇 년 전에 읽었던 책도 다시 읽으면 지난날에는 모르고 지나친 삶의 다양한 결을 다시 짚어보게 되게 되는 것처럼, 경제적 자유라는 목적을 세운 후에 독서를 하다 보면, 우리 삶을 송두리째 바꿀 만큼 엄청난 변화를 경험할 수 있다. 이 책에서는 우리가 사는 자본주의 세상에서 경제가 어떻게 돌아가는지, 어떤 사회구조인지, 사람들은 무엇에 관심이 있는지를 알 수 있도록 23권의 책을 엄선해 소개한다.

《총, 균, 쇠》를 소개할 때는 우리나라 최고의 이코노미스트 홍춘욱 박사가 세계 최강국의 부의 비밀과 역사에 대해 이야기하고, 김학렬 소장은 재레드 다이아몬드가 학자가 아니라 투자자였다면 ‘입지의 중요성’을 잘 알고 있기에 부동산 투자를 잘했을 것이라는 흥미로운 평도 내놓는 등 국내에서 내로라하는 투자가들의 주옥같은 조언을 더했다. 이를 통해 책을 한 권 한 권 읽을 때마다 새로운 사실을 알게 되고, 세상을 다른 눈으로 볼 수 있도록 도와준다.",913,BOOK
