title,author,genre_id,genre,ISBN,description_aladin,description_naver,salesPoint,mallType
초록 거북,릴리아 (지은이),35134,국내도서>유아>그림책>나라별 그림책>한국 그림책,9788956180021,"&lt;파랑 오리&gt;를 이은 릴리아 작가의 또 다른 가족 이야기. 릴리아 작가의 전작 &lt;파랑 오리&gt;에서 다정하고 섬세한 사랑의 방식으로 가족이 그려졌다면, 이번에 출간되는&lt;초록 거북&gt;에서는 각자의 역할을 묵묵히 해내며 서로 의지하는 마음을 담았다.","『파랑 오리』를 이은 릴리아 작가의 또 다른 가족 이야기

“아빠, 바람이 지나가는 소리가 들려요?”

[줄거리]
하늘, 풀, 꽃, 나비……. 아빠는 아기 거북에게 보여 주고 싶은 게 아주 많았어요. 
 들려주고 싶은 소리도 많았어요. 
 새들의 노랫소리, 나뭇잎이 떨어지는 소리, 풀과 나무 사이로 들려오는 소리. 
 아빠는 아기 거북에게 숫자를 세는 법과 몇 가지 단어를 가르쳐 주었지만, 
 그럴 때마다 아기 거북은 울먹울먹하다가 크게 울음을 터뜨렸어요. 
 그날 이후로 아빠는 서두르지 않기로 했어요.
 아기 거북의 자라는 모습은 아빠에게 늘 힘이 되었지요.  
 언제부터인가 아빠의 일은 거북의 몫이 되었어요. 하지만 둘은 언제나 함께했어요.
 이제 거북이 아빠에게 말해요. ‘난 아빠에게 보여주고 싶은 게 너무나 많아요.’",1943,BOOK
손끝과 연연 3,모리시타 수 (지은이),3743,국내도서>만화>순정만화>틴에이지 순정,9791134882921,여대생 유키는 어느날 곤란에 처해있을 때 같은 대학 선배인 이츠오미의 도움을 받는다. 청각장애가 있어 귀가 들리지 않는 유키에게도 동요하지 않고 자연스럽게 대해주는 이츠오미. 자신에게 새로운 세계를 느끼게 해준 이츠오미를 유키는 점점 의식하기 시작하는데…?!,"좋아하게 된다. 제한 없는 느낌으로.

대학생인 유키는 청각장애가 있어 귀가 들리지 않는 자신에게도 동요하지 않고 자연스럽게 대해주는 대학 선배 이츠오미에게 끌려 좋아하게 된다. 이 사랑과 똑바로 마주해 노력해 볼 것을 결의한 유키. 무슨 생각을 하는지 알 수 없었던 이츠오미도 점점 유키에게 본심을 말하게 되는데?

청각장애가 있는 여자 유키와, 세계를 바꾸어준 선배 이츠오미의 순수한 러브스토리 제3권♥",942,BOOK
"2021 iMBC 캠퍼스 한국사능력검정시험 기출문제집 심화 (1, 2, 3급) - 동영상강의 무료(15일)",iMBC 캠퍼스 한국사연구회 (지은이),166525,"국내도서>수험서/자격증>한국사능력검정시험>심화(1,2,3급)",9788963928852,"기출문제 위에 펜으로 직접 풀이하듯이 해설을 작성하여 학생들의 이해를 돕고, 해설 학습을 통한 반 복 학습이 이루어질 수 있게 구성한 수험서다. 문항별 난이도를 설정하여 원하는 급수별 학습해야 할 영역을 나누어 놓았다.","1. 기출문제 위에 펜으로 직접 풀이하듯이 해설을 작성하여 학생들의 이해를 돕고, 해설 학습을 통한 반 복 학습이 이루어질 수 있게 구성하였습니다. 
2 문항별 난이도를 설정하여 원하는 급수별 학습해야 할 영역을 나누어 놓았습니다. 
  - 1급을 목표로 하는 수험생은 별 3개 주제까지 모두 학습 
  - 2, 3급을 목표로 하는 수험생은 별 1개 주제와 별 2개 주제에 대한 학습에 중점(물론 기출된 내용이므 로 급수와 관계없이 모든 문제를 풀이해 보아야 합니다) 
3 기출 문제와 관련된 이론을 함께 실어 학습의 효율성을 높였습니다. 

본서 활용 순서 
① 기출 문제 풀이 → ② 사료와 오답 지문까지 포함한 꼼꼼한 해설 학습 및 관련 이론 학습 → ③ 모의고 사 문제 풀이 → ④ 해설 학습 및 관련 이론 학습 → ⑤ 오답 문제 중심 반복 학습",237,BOOK
2021 함께하는 교육학 논술이론편 1 - 중등교원 임용고시 대비,"전태련, 박지영 (지은이)",34726,국내도서>수험서/자격증>공무원 수험서>교원임용시험>교육학,9791197393303,2017년 대비 중등교원임용 교육학 논술 기본이론서.,"『함께하는 교육학. 1 논술이론편』은 〈교육심리〉, 〈교육과정〉, 〈교수-학습 & 교육공학〉등을 수록하고 있는 책이다.",2891,BOOK
지지 않기 위해 쓴다 - 분노는 유쾌하게 글은 치밀하게,"바버라 에런라이크 (지은이), 김희정 (옮긴이)",51061,국내도서>사회과학>비평/칼럼>국제사회비평/칼럼,9788960518704,체험형 글쓰기의 대가 바버라 에런라이크. 그가 삶의 가장자리에서 끌어올린 불평등의 연대기를 담은 책이다.,"체험형 글쓰기의 대가 바버라 에런라이크
그가 삶의 가장자리에서 끌어올린 불평등의 연대기

바버라 에런라이크는 철저히 ‘체험형 글쓰기’를 표방하는 저널리스트로, 3년간 워킹푸어로 일한 경험을 담은 《노동의 배신》을 2001년 출간하면서 세계적인 밀리언셀러 작가로 발돋움했다. 이 책은 35년간 바버라 에런라이크가 《가디언》 《타임》 《뉴욕타임스》 《허핑턴포스트》 《네이션》 등 유수의 언론 매체에 기고했던 칼럼 모음집이자, 그의 말에 따르면 ‘도덕적 분노에 불을 지폈던 글’을 묶은 것이다. 1장 ‘가진 자와 가지지 못한 자’에서는 빈곤과 불평등 문제를, 2장 ‘몸과 마음을 통제할 수 있다는 착각’에서는 건강 열풍의 숨은 진실을 파헤친다. 3장 ‘지금 여기, 남성에 대하여’와 4장 ‘여성들이 계속 써야 하는 이유’에서는 페미니스트로서 남성과 여성의 시대적 문제들을 짚어본다. 5장 ‘신, 과학, 그리고 기쁨’에서는 과학자 출신답게 종교와 과학에 대해 면밀하게 문제를 제기하고, 6장 ‘중산층 몰락 사회의 탄생’에서는 계층 양극화의 심화를 고찰하며 깊은 빛나는 통찰을 이끌어 낸다. ‘탁월한 르포 작가’ ‘행동하는 저널리스트’라는 명성답게 총 6가지 주제와 36개의 글에서는 에런라이크가 생생한 경험에서 길어 올린 날카로운 진단과 그 특유의 풍자뿐 아니라 냉혹한 예견까지 엿볼 수 있다.",364,BOOK
식물과 같이 살고 있습니다,식물 집사 리피 (지은이),53572,국내도서>건강/취미>원예>화훼,9788950995539,"식물과 함께하기로 결정한 집사들을 위해, 아주 기초적이지만 막상 누구도 알려주지 않는 식물 기초 지식과 관리법에 대해서 이야기한다. 수많은 초보 식물 집사들을 상담한 경험을 바탕으로 실전에서 유용하게 쓰일 수 있는 정보를 정리했다.","좋아하는 일을 더 재미있게, 탐탐 시리즈 01.
17만 식물 집사들의 주치의 '식물 집사 리피'의 반려식물 상식 사전

내가 좋아하는 세상을 찾다! 좋아하는 대상을 즐기는(耽) 것을 넘어, 적극적으로 파고들어 탐구하고(探) 전파하는 사람들의 이야기를 전하는 ‘탐탐(耽探)’ 시리즈의 첫 번째 책이 출간됐다. 반려식물, 유튜브, 필라테스, 레진아트, 와인 등 각 분야의 전문 크리에이터들이 초보 취미 생활자들에게 좋아하는 것들의 매력을 전파하는 탐탐 시리즈에서는 독자들의 일상을 풍부하게 해줄 세상의 모든 취미를 찾아내 소개한다. 
《식물과 같이 살고 있습니다》는 식물과 함께 살아가기로 결정한 식물 집사들을 위해, 아주 기본적이지만 막상 누구도 알려주지 않는 식물 지식과 관리법에 대해서 이야기하는 책이다. 식물 집사들이 특히 많이 키우는 50개 반려식물을 선정해 식물에 대한 기초 정보와 물 주기, 햇빛, 온도 등 그 식물에 맞는 관리 방법을 정리했다. 단순한 관리법뿐만 아니라, 식물이 어떻게 성장하고 어떤 특성을 가지고 있는지를 먼저 알려줘 함께하는 식물을 진정으로 이해할 수 있도록 돕는다. 
이 책은 식물을 좋아하는 사람이 좋아하는 것과 함께하는 삶을 위해 꼭 알아야 할 기본적인 이야기를 담았다. 베테랑 집사인 리피가 소개하는 과정을 따라가다 보면, 일상에서 식물이 주는 기쁨을 만끽할 수 있는 진정한 식물 집사가 될 수 있을 것이다.",694,BOOK
엉망으로 살자 - 더 열심히 놀기 위해 세상과 타협하는 법,노선경 (지은이),51371,국내도서>에세이>한국에세이,9791197080869,팬티요정이라 불리는 크리에이터 노선경의 에세이. 저자는 행복하게 놀고 나서야 비로소 그 행복을 다시 얻기 위해 더 열심히 일할 수 있다고 말한다. 어떤 분야의 최고가 되라는 것이 아닌 뭐든 좋으니 미쳐있으라 그녀는 말한다.,"세상에서 가장 게으른 일러스트레이터, 노선경의 4년만의 신작!

지금까지 이런 저자는 없었다. 팬티요정이라 불리는 크리에이터 노선경!
페이스북과 인스타그램을 하다 보면 한 번씩 본 적 있는 그녀의 그림은
한 때 크게 주목받는 일러스트레이터이고 지금은 크리에이터로도 활발하게
활동하며 입지를 크게 다지고 있다. 첫 번째 책인 《훗날 내 청춘을 떠올리면 네가 가장 먼저 생각날 거야》가
사랑하는 사람과 나누는 행복한 일상이었다면 이번에는 180도 다른 《엉망으로 살자》라는 파격적인 책으로 돌아왔다. 

제목만 보면 인생 막 살자는 뜻으로 오해할 수 있지만 그건 아니다.

""열심히 일한 만큼 열심히 놀자""라는 말은 순서가 잘못됐다.
행복하게 놀고 나서야 비로소 그 행복을 다시 얻기 위해 더 열심히 일할 수 있다고 말한다.
《엉망으로 살자》는 더 열심히 놀기 위해 세상과 타협하는 법을 배울 수 있다고 보면 된다. 

저자 노선경은 대충 사는 듯 열심히 살았고, 좋아서 하는 일에 애매한 결과는 단 하나도 없었다.

어떤 분야의 최고가 되라는 것이 아닌 뭐든 좋으니 미쳐있으라 그녀는 말한다. 
저자의 조언을 듣다보면 당신도 어쩌면 한 분야에 미쳐서 할 수 있는 일을 찾는 건 시간 문제이지 않을까 싶다.",705,BOOK
"번역에 살고 죽고 - 치열하고도 즐거운 번역 라이프, 개정판",권남희 (지은이),51371,국내도서>에세이>한국에세이,9788960906822,"30년 차 베테랑 번역가를 넘어 작가로서도 자리매김한 권남희 번역가의 첫 번째 산문집 『번역에 살고 죽고』가 출간 10주년을 맞아 개정판으로 재출간됐다. 개정판 출간은 그동안 ‘번살죽’을 기다려온 독자는 물론, 전업 프리랜서 번역가를 지망하는 이들에게도 반가운 소식이 될 것이다.","글 쓸 때도 번역할 때만큼이나 행복하다
일본문학 번역가 권남희의 치열하고 즐거운 번역 라이프

지은이는 자신을 ‘소심쟁이’이며 ‘은둔형외톨이’라고 거듭 강조하지만, 글에서 엿보이는 그의 내면적 일상은 소심하거나 외톨이이기는커녕 발랄하고 다채로우며 극히 자유롭다. 번역가를 지망하는 젊은이들에게 그 세계를 꼼꼼하고 소상하게 안내해주는 대목이 아니더라도, 이 책은 책 읽기와 글쓰기와 번역을 사랑하는 한 번역가의 따뜻한 에세이로 읽힌다.
─故남경태(번역가, 인문학 저술가, 『개념어 사전』 저자)

30년 차 베테랑 번역가를 넘어 작가로서도 자리매김한 권남희 번역가의 첫 번째 산문집 『번역에 살고 죽고』가 출간 10주년을 맞아 개정판으로 재출간됐다. 2011년, 번역 생활 20년을 돌아보며 정리한 이 책은 단숨에 ‘번살죽(『번역에 살고 죽고』의 약칭)’ 애독자를 형성하며 크게 주목받았다. ‘무학자無學者도 재미있게 읽을 수 있는 글쓰기’를 모토로 꾸준히 온라인상에 글을 써온 필력과 특유의 유머로, 맨땅에 헤딩하듯 뛰어든 프리랜서 번역가의 세계를 생생하게 보여준다.
올해 출간된 『혼자여서 좋은 직업』은 확고하게 자기 위치를 확립한 뒤, 조금은 느긋하고 여유롭게 번역이라는 일을 즐기면서 사는 이야기를 담았다. 반면에 『번역에 살고 죽고』는 겁 없이 프리랜서 번역가의 세계로 뛰어들어 좌충우돌하며 자리 잡기까지의 고생담에 가깝다. 당시 책을 읽은 독자들은 온라인 서점 등에 “이 책을 읽지 않고는 번역가 꿈도 꾸지 않는 게 좋다” “오랜만에 남의 인생 이야기에 신나게 웃고, 어부지리로 교양까지 얻었다” “솔직하게 경험담을 밝히면서 이처럼 발랄하고 재미있다니! 근래 읽은 최고의 에세이!” 같은 찬사를 보내며 새로운 에세이스트의 탄생을 기뻐했다.
이번 개정판은 올해 『혼자여서 좋은 직업』이 출간된 후, 끊임없는 독자들의 성원에 힘입어 나오게 되었다. 본문은 10년이라는 세월의 흐름에 따라 전반적으로 표현을 세심하게 매만졌고, 표지는 두 권을 함께 소장하기 좋도록 판형을 맞췄으며 최연주 그림작가의 모노톤 일러스트로 대비를 주었다. 개정판 출간은 그동안 ‘번살죽’을 기다려온 독자는 물론, 전업 프리랜서 번역가를 지망하는 이들에게도 반가운 소식이 될 것이다.",555,BOOK
보건교사 안은영 (특별판),정세랑 (지은이),50993,국내도서>소설/시/희곡>한국소설>2000년대 이후 한국소설,9788937479953,2015년 12월에 출간되어 꾸준한 사랑을 받아 온 &lt;보건교사 안은영&gt;이 출간 5주년과 작품 영상화를 기념하여 '리커버 특별판'으로 출간되었다. 2010년 단편소설에서 탄생한 '안은영'이 '넷플릭스 오리지널 시리즈'의 히어로가 되기까지의 소회가 담긴 작가의 편지로부터 책은 시작한다.,"본격 학원 명랑 미스터리 소설 
출간 5주년 & 영상화 기념 리커버 특별판 출간!

2015년 12월에 출간되어 꾸준한 사랑을 받아 온 『보건교사 안은영』이 출간 5주년과 작품 영상화를 기념하여 ‘리커버 특별판’으로 출간되었다. 2010년 단편소설에서 탄생한 ‘안은영’이 ‘넷플릭스 오리지널 시리즈’의 히어로가 되기까지의 소회가 담긴 작가의 편지로부터 책은 시작한다. 그 시간 동안 안은영이 자신에게 좋은 친구가 되어 주었다는 정세랑의 고백은 아마 많은 독자에게도 마찬가지일 것이다. 

그 친구가 오랜만에 새 옷을 입었다. 일러스트레이터 ‘람한’의 작업으로 새로 탄생한 표지 디자인은 소설의 세계관을 충실히 반영하는 동시에 유니크한 색감과 구성으로 독자들의 소장 욕구를 자극한다. 또한 책의 뒤편에 자리한 다섯 편의 추천사는 독서를 마친 이들에게 편안하고 다정한 대화 상대가 될 것이다. 에세이스트 김혼비, 팟캐스트 ‘듣똑라’ 팀장 김효은 기자, 배우 이설, 작가 이슬아와 시인 황인찬이 필진으로 참여했다. 지금 이때에 더없이 적절한 메시지를 담은 정세랑 작가의 사인(인쇄)은 빛나는 덤이다.",19562,BOOK
읽기만 하면 내 것이 되는 1페이지 미술 365 (고흐 에디션),김영숙 (지은이),50978,국내도서>예술/대중문화>미술>미술 이야기,9791190931106,"매일 1페이지씩, 세계 명화 365점과 함께 미술의 모든 지식을 단 한 권으로 만날 수 있는 책이다. 월요일부터 일요일까지 명작, 미술사, 화가, 장르·기법, 미술로 보는 세계사, 스캔들·미스터리, 신화·종교 총 일곱 분야의 지식을 다루고 있어 꼭 알아야 할 미술 교양을 빠짐없이 쌓을 수 있다.","문득, 미술관에 가고 싶은 당신에게
1일 1페이지, 세계 명화 365점을 만나는 아름다운 교양수업

『읽기만 하면 내 것이 되는 1페이지 미술 365』는 매일 1페이지씩, 세계 명화 365점과 함께 미술의 모든 지식을 단 한 권으로 만날 수 있는 책이다. 월요일부터 일요일까지 명작, 미술사, 화가, 장르·기법, 미술로 보는 세계사, 스캔들·미스터리, 신화·종교 총 일곱 분야의 지식을 다루고 있어 꼭 알아야 할 미술 교양을 빠짐없이 쌓을 수 있다.

반 고흐, 렘브란트처럼 잘 알려진 화가부터 콜비츠, 키르히너 등 우리가 미처 잘 몰랐던 근대화가의 눈부신 명작들을 엄선해 다뤘고, 회화뿐 아니라 조각, 고대벽화, 판화 등 다양한 장르의 미술 작품을 충실히 담았다. 단지 화가와 작품에 대한 소개에서 끝나는 것이 아니라, 그림에 얽힌 세계사·신화·기법·미스터리 등 풍성한 뒷이야기를 함께 소개해 재미있게 읽기만 하면 인문학 지식 세계가 확장되는 경험을 할 수 있다.",12321,BOOK
동물농장,"조지 오웰 (지은이), 도정일 (옮긴이)",50919,국내도서>소설/시/희곡>영미소설,9788937460050,1945년에 간행된 조지 오웰의 대표작. 어떤 농장의 동물들이 늙은 돼지 메이저의 부추김에 빠져 농장주의 압제에 대항해 반란을 일으켜 인간의 착취가 없는 '모든 동물이 평등한 이상사회'를 건설한다. 그러나 돼지들이 지도자가 되어 다시 동물들을 압박하기 시작하는데...,"풍자 우화를 통한 사회 비판을 담은 기념비적 소설
 
“모든 동물은 평등하다. 그러나 어떤 동물은 다른 동물들보다 더 평등하다.”

우화 형식으로 당대의 정치적 현실을 날카롭게 묘파한 『동물농장』은 『1984』, 『카탈로니아 찬가』와 함께 조지 오웰이 47세의 나이로 갑작스레 사망하기 전 짧은 작가 생활 동안 남긴 영국 문학의 위대한 결실이다. 이 작품이 영국에서 처음 출간된 것은 2차 세계 대전이 갓 끝난 1945년이었다. 소련과 사회주의에 민감하던 세계 정치적 분위기에서 이 작품은 처음엔 거의 모든 출판사에서 출판을 거절할 정도로 홀대받았으나, 그의 전작 『카탈로니아 찬가』를 출간했던 섹커 앤드 와버그 출판사의 결정으로 겨우 출간에 이를 수 있었다. 사실상 전시(戰時)나 다름없던 무렵 『동물농장』은 출간되자마자 초판 4500부가 매진되고 재쇄를 거듭한 끝에 영국과 미국 모두에서 베스트셀러가 되었다. 그 이후 70여 년이 훌쩍 지난 지금까지 『동물농장』의 판매량은 세계적으로 1천만 부 이상을 넘은 것으로 알려져 있다.

조지 오웰은 『동물농장』에서 인간의 속박에서 벗어나 혁명을 이루고 이상 사회를 건설한 동물 공동체가 변질되는 모습을 통해 구소련의 역사를 재현하며 스탈린 독재 체제를 강도 높게 비판한다. 작중 여러 등장인물 중 인간 주인인 존즈는 러시아 황제 니콜라스 2세를, 혁명을 호소하는 늙은 메이저는 마르크스를, 독재자 나폴레옹은 스탈린을, 나폴레옹에게 축출당하는 스노볼은 트로츠키를 상징한다. 또한 이야기 속에 등장하는 ‘동물학살’과 ‘외양간 전투’ 역시 각기 스탈린 시대의 대숙청과 연합군 침공 등으로 연결된다. 혁명이 성공한 후에 어떻게 변질되고, 권력을 잡은 지도자들이 어떻게 국민을 속이고 핍박하는지를 면밀히 그린 이 우화는 특정한 시대에만 한정되어 읽히지 않는다. 이 작품은 인류가 사회를 이루고 살 때부터 벌어진 ‘독재’를 함축적인 등장인물과 사건을 통해 그려내어 지금까지도 유효한 풍자를 담고 있으며, 그렇기에 조지 오웰이 지닌 사회비판적 문학의 역량이 여실히 드러나는 작품이다.",70760,BOOK
아주 작은 습관의 힘 - 최고의 변화는 어떻게 만들어지는가,"제임스 클리어 (지은이), 이한이 (옮긴이)",70216,국내도서>자기계발>성공>성공학,9791162540640,"저자의 생생한 경험과 생물학, 뇌과학, 심리학의 최신 연구 결과를 집약해서 습관 하나로 인생을 변화시킬 수 있는 노하우를 제시한다. 어떤 습관을 자신의 무기로 만들기 위해서는 딱 네 가지만 기억하면 된다. 바로 ‘행동 변화의 4가지 법칙’인데, 모든 습관은 분명하고(제1법칙), 매력적이고(제2법칙), 쉽고(제3법칙), 만족스러워야(제4법칙) 한다는 것이다.","더 이상 아무것도 할 수 없을 것 같았던 때 조금씩 시도한 아주 작은 일들이 삶을 바꿨다!

단계적이고 체계적인 자기계발 방법을 찾는 사람들을 위한 『아주 작은 습관의 힘』. 고교 시절 촉망받는 야구선수였던 저자는 연습 중 동료의 야구 배트에 얼굴을 정통으로 강타당하는 큰 사고를 당했고, 걸을 수조차 없었던 저자는 절망에 빠지는 대신 지금 당장 할 수 있는 아주 작은 일이라도 찾아 그것을 반복하자고 마음먹었다. 그 후 매일 걷기 연습을 해서 6개월 만에 운동을 할 수 있게 되었고, 6년 후에는 대학 최고 남자 선수가 되었다. 

그 후 자신을 인생의 나락에서 구해준 아주 작은 습관의 힘을 전 세계에 알리는 최고의 자기계발 전문가가 된 저자는 이 책에서 자신의 생생한 경험과 생물학, 뇌과학, 심리학의 최신 연구 결과를 집약해서 습관 하나로 인생을 변화시킬 수 있는 노하우를 제시한다. 저자는 더 나은 습관을 세우는 계획에 대해 단계별로 소개한다. 습관을 만들기 위해서는 결심이 분명해야 하고(제1법칙), 매력적이어야 하며(제2법칙), 쉬워야 하고(제3법칙), 만족스러워 하는데(제4법칙), 이 네 가지 법칙을 바탕으로 어떻게 하면 빠르고, 효율적이고, 확실하게 변화할 수 있는지 알려준다. 

금연, 다이어트에서부터 비즈니스에서 탁월한 성과를 이뤄내기까지 누구나 쉽게 이해하고 적용할 수 있는 방식으로 습관을 세우고 삶을 변화시키는 과학적인 방법을 설명한다. 저자는 사소하고 별것 아닌 일이라도 몇 년 동안 꾸준히 해나가면 정말로 놀랄 만한 결과가 나타난다고 이야기하며 이 책에서 제안하는 방법으로 매일 조금씩 좋은 습관을 만든다면 무엇을 결심하든 원하는 것을 얻을 수 있다는 용기와 희망을 전한다.",68961,BOOK
흔한남매 6,"흔한남매 (지은이), 백난도 (글), 유난희 (그림), 흔한컴퍼니 (감수)",49995,국내도서>어린이>TV/만화/영화>만화 일반,9791164136261,‘흔한남매’ 유튜브 영상의 스토리를 앙증맞고 유머러스한 만화로 풀어 낸 코믹북이다. 하루도 조용할 날이 없는 으뜸이와 에이미의 일상 스토리는 진짜 웃음이 필요한 어린이들에게 순수한 웃음과 유쾌한 우애를 선사할 것이다.,"유튜브 207만 구독 돌파! 인기 크리에이터 흔한남매
흔한남매가 선사하는 유쾌한 우애와 순수한 웃음!

가을 하늘처럼 청량한 흔한남매의 웃음과 유머!

‘흔한남매’는 유튜브 구독자 수가 207만 명, 누적 조회 수가 14억 회를 넘어서는 인기 크리에이터로, 흔한컴퍼니에 소속되어 있습니다. 상황극 콩트 등을 통해 어린이들에게 큰 사랑을 받고 있으며, 주로 남매 사이에서 일어날 수 있는 현실적인 에피소드를 코믹하게 그려 내어 웃음과 공감을 이끌어 내고 있습니다. 《흔한남매 6》은 ‘흔한남매’ 유튜브 영상의 스토리를 앙증맞고 유머러스한 만화로 풀어 낸 코믹북입니다. 하루도 조용할 날이 없는 으뜸이와 에이미의 일상 스토리는 진짜 웃음이 필요한 어린이들에게 순수한 웃음과 유쾌한 우애를 선사할 것입니다.

으뜸이의 눈앞에 나타난 에이미의 도플갱어, 우당탕탕 캠핑 스토리, 데이지의 두근두근 짝사랑, 핼러윈 데이에 재밌게 노는 꿀팁, 흔한 사나이의 치열한 라면 요리 대결, 으뜸이와 에이미의 어릴 적 일기 등 웃음이 솔솔 불어오는 흔한남매의 일상을 만나 볼까요?",15895,BOOK
